Id	Source	Nucleotide Accession	Start	Stop	Strand	Protein	Protein Name	Organism	Strain	Assembly
1521601	INSDC	BX548174.1	1274850	1276199	+	CAE19782.1	putative GPH family sugar transporter	Prochlorococcus marinus subsp. pastoris str. CCMP1986	MED4	GCA_000011465.1
1521601	RefSeq	NC_005072.1	1274850	1276199	+	WP_011132957.1	MFS transporter	Prochlorococcus marinus subsp. pastoris str. CCMP1986	MED4	GCF_000011465.1
1521601	RefSeq	NZ_CP138914.1	513816	515165	+	WP_011132957.1	MFS transporter	Prochlorococcus sp. Dvax-bc1017	Dvax-bc1017	GCF_047302725.1
1521601	RefSeq	NZ_CP138922.1	1657631	1658980	-	WP_011132957.1	MFS transporter	Prochlorococcus marinus subsp. pastoris str. CCMP1986	MED4x	GCF_047497115.1
1521601	RefSeq	NZ_CP138923.1	168529	169878	-	WP_011132957.1	MFS transporter	Prochlorococcus marinus subsp. pastoris str. CCMP1986	MED4ax	GCF_047497125.1
1521601	RefSeq	NZ_CP138976.1	1012489	1013838	-	WP_011132957.1	MFS transporter	Prochlorococcus sp. MED1	MED1	GCF_047305115.1
1521601	RefSeq	NZ_JNAG01000004.1	68354	69703	-	WP_011132957.1	MFS transporter	Prochlorococcus marinus str. EQPAC1	EQPAC1	GCF_000759875.1
