Id	Source	Nucleotide Accession	Start	Stop	Strand	Protein	Protein Name	Organism	Strain	Assembly
1747863	INSDC	BX548174.1	980573	980899	+	CAE19494.1	possible DNA gyrase/topoisomerase IV, subunit	Prochlorococcus marinus subsp. pastoris str. CCMP1986	MED4	GCA_000011465.1
1747863	RefSeq	NC_005072.1	980573	980899	+	WP_011132668.1	hypothetical protein	Prochlorococcus marinus subsp. pastoris str. CCMP1986	MED4	GCF_000011465.1
1747863	RefSeq	NZ_CP138914.1	219533	219859	+	WP_011132668.1	hypothetical protein	Prochlorococcus sp. Dvax-bc1017	Dvax-bc1017	GCF_047302725.1
1747863	RefSeq	NZ_CP138922.1	293341	293667	-	WP_011132668.1	hypothetical protein	Prochlorococcus marinus subsp. pastoris str. CCMP1986	MED4x	GCF_047497115.1
1747863	RefSeq	NZ_CP138923.1	463836	464162	-	WP_011132668.1	hypothetical protein	Prochlorococcus marinus subsp. pastoris str. CCMP1986	MED4ax	GCF_047497125.1
1747863	RefSeq	NZ_CP138976.1	1307796	1308122	-	WP_011132668.1	hypothetical protein	Prochlorococcus sp. MED1	MED1	GCF_047305115.1
1747863	RefSeq	NZ_JNAG01000001.1	84156	84482	-	WP_011132668.1	hypothetical protein	Prochlorococcus marinus str. EQPAC1	EQPAC1	GCF_000759875.1
