Id	Source	Nucleotide Accession	Start	Stop	Strand	Protein	Protein Name	Organism	Strain	Assembly
1585352	INSDC	BX548174.1	89838	91241	+	CAE18543.1	possible sodium transporter, Trk family	Prochlorococcus marinus subsp. pastoris str. CCMP1986	MED4	GCA_000011465.1
1585352	RefSeq	NC_005072.1	89838	91241	+	WP_011131722.1	potassium transporter TrkG	Prochlorococcus marinus subsp. pastoris str. CCMP1986	MED4	GCF_000011465.1
1585352	RefSeq	NZ_CP138914.1	986793	988196	+	WP_011131722.1	potassium transporter TrkG	Prochlorococcus sp. Dvax-bc1017	Dvax-bc1017	GCF_047302725.1
1585352	RefSeq	NZ_CP138922.1	1184793	1186196	-	WP_011131722.1	potassium transporter TrkG	Prochlorococcus marinus subsp. pastoris str. CCMP1986	MED4x	GCF_047497115.1
1585352	RefSeq	NZ_CP138923.1	1355288	1356691	-	WP_011131722.1	potassium transporter TrkG	Prochlorococcus marinus subsp. pastoris str. CCMP1986	MED4ax	GCF_047497125.1
1585352	RefSeq	NZ_CP138976.1	539555	540958	-	WP_011131722.1	potassium transporter TrkG	Prochlorococcus sp. MED1	MED1	GCF_047305115.1
1585352	RefSeq	NZ_JNAG01000002.1	125489	126892	-	WP_011131722.1	potassium transporter TrkG	Prochlorococcus marinus str. EQPAC1	EQPAC1	GCF_000759875.1
1585352	INSDC	JNAG01000002.1	125489	126892	-	KGF88165.1	Potassium uptake protein TrkH	Prochlorococcus marinus str. EQPAC1	EQPAC1	GCA_000759875.1
