Id	Source	Nucleotide Accession	Start	Stop	Strand	Protein	Protein Name	Organism	Strain	Assembly
1575767	INSDC	BX548174.1	692919	694556	-	CAE19188.1	possible ATP-dependent DNA ligase	Prochlorococcus marinus subsp. pastoris str. CCMP1986	MED4	GCA_000011465.1
1575767	RefSeq	NC_005072.1	692919	694556	-	WP_011132363.1	ATP-dependent DNA ligase	Prochlorococcus marinus subsp. pastoris str. CCMP1986	MED4	GCF_000011465.1
1575767	RefSeq	NZ_CP138914.1	1589868	1591505	-	WP_011132363.1	ATP-dependent DNA ligase	Prochlorococcus sp. Dvax-bc1017	Dvax-bc1017	GCF_047302725.1
1575767	RefSeq	NZ_CP138922.1	579533	581170	+	WP_011132363.1	ATP-dependent DNA ligase	Prochlorococcus marinus subsp. pastoris str. CCMP1986	MED4x	GCF_047497115.1
1575767	RefSeq	NZ_CP138923.1	750028	751665	+	WP_011132363.1	ATP-dependent DNA ligase	Prochlorococcus marinus subsp. pastoris str. CCMP1986	MED4ax	GCF_047497125.1
1575767	RefSeq	NZ_CP138976.1	1594139	1595776	+	WP_011132363.1	ATP-dependent DNA ligase	Prochlorococcus sp. MED1	MED1	GCF_047305115.1
1575767	RefSeq	NZ_JNAG01000006.1	78124	79761	+	WP_011132363.1	ATP-dependent DNA ligase	Prochlorococcus marinus str. EQPAC1	EQPAC1	GCF_000759875.1
1575767	INSDC	JNAG01000006.1	78124	79761	+	KGF85887.1	ATP-dependent DNA ligase LigC	Prochlorococcus marinus str. EQPAC1	EQPAC1	GCA_000759875.1
