Id	Source	Nucleotide Accession	Start	Stop	Strand	Protein	Protein Name	Organism	Strain	Assembly
1611210	INSDC	BX548174.1	1233875	1234831	-	CAE19743.1	PhoH-like phosphate starvation-inducible protein	Prochlorococcus marinus subsp. pastoris str. CCMP1986	MED4	GCA_000011465.1
1611210	RefSeq	NC_005072.1	1233875	1234831	-	WP_011132918.1	PhoH family protein	Prochlorococcus marinus subsp. pastoris str. CCMP1986	MED4	GCF_000011465.1
1611210	RefSeq	NZ_CP138914.1	472837	473793	-	WP_011132918.1	PhoH family protein	Prochlorococcus sp. Dvax-bc1017	Dvax-bc1017	GCF_047302725.1
1611210	RefSeq	NZ_CP138922.1	39407	40363	+	WP_011132918.1	PhoH family protein	Prochlorococcus marinus subsp. pastoris str. CCMP1986	MED4x	GCF_047497115.1
1611210	RefSeq	NZ_CP138923.1	209902	210858	+	WP_011132918.1	PhoH family protein	Prochlorococcus marinus subsp. pastoris str. CCMP1986	MED4ax	GCF_047497125.1
1611210	RefSeq	NZ_CP138976.1	1053860	1054816	+	WP_011132918.1	PhoH family protein	Prochlorococcus sp. MED1	MED1	GCF_047305115.1
1611210	RefSeq	NZ_JNAG01000004.1	109745	110701	+	WP_011132918.1	PhoH family protein	Prochlorococcus marinus str. EQPAC1	EQPAC1	GCF_000759875.1
1611210	INSDC	JNAG01000004.1	109745	110701	+	KGF87153.1	Phosphate starvation-inducible protein PhoH	Prochlorococcus marinus str. EQPAC1	EQPAC1	GCA_000759875.1
