Id	Source	Nucleotide Accession	Start	Stop	Strand	Protein	Protein Name	Organism	Strain	Assembly
1505099	INSDC	BX548175.1	973219	973959	-	CAE21068.1	ABC transporter for amino acids, ATP binding component	Prochlorococcus marinus str. MIT 9313	MIT9313	GCA_000011485.1
1505099	RefSeq	NC_005071.1	973219	973959	-	WP_011130271.1	amino acid ABC transporter ATP-binding protein	Prochlorococcus marinus str. MIT 9313	MIT9313	GCF_000011485.1
1505099	RefSeq	NZ_CP138957.1	854898	855638	+	WP_011130271.1	amino acid ABC transporter ATP-binding protein	Prochlorococcus sp. MIT 1342	MIT 1342	GCF_047304495.1
1505099	RefSeq	NZ_LVHS01000019.1	54312	55052	+	WP_011130271.1	amino acid ABC transporter ATP-binding protein	Prochlorococcus marinus str. MIT 1342	MIT 1342	GCF_001632145.1
1505099	INSDC	LVHS01000019.1	54312	55052	+	KZR83544.1	Glutamine transport ATP-binding protein GlnQ	Prochlorococcus marinus str. MIT 1342	MIT 1342	GCA_001632145.1
