Id	Source	Nucleotide Accession	Start	Stop	Strand	Protein	Protein Name	Organism	Strain	Assembly
1459561	INSDC	BX548175.1	313416	314186	+	CAE20449.1	Imidazole glycerol phosphate synthase subunit HisF (cyclase)	Prochlorococcus marinus str. MIT 9313	MIT9313	GCA_000011485.1
1459561	RefSeq	NC_005071.1	313416	314186	+	WP_011129653.1	imidazole glycerol phosphate synthase subunit HisF	Prochlorococcus marinus str. MIT 9313	MIT9313	GCF_000011485.1
1459561	Swiss-Prot	N/A				Q7V8Q8.1	Imidazole glycerol phosphate synthase subunit hisF1	Prochlorococcus marinus str. MIT 9313		
1459561	PAT	N/A				AKW56003.1	Sequence 10167 from patent US 8952217	Unknown		
1459561	PAT	HC900014.1	1	771	+	CBN64426.1	unnamed protein product	Prochlorococcus marinus		
