Id	Source	Nucleotide Accession	Start	Stop	Strand	Protein	Protein Name	Organism	Strain	Assembly
1467180	INSDC	BX548175.1	1591304	1593208	-	CAE21681.1	RNA polymerase gamma subunit	Prochlorococcus marinus str. MIT 9313	MIT9313	GCA_000011485.1
1467180	RefSeq	NC_005071.1	1591304	1593208	-	WP_011130874.1	DNA-directed RNA polymerase subunit gamma	Prochlorococcus marinus str. MIT 9313	MIT9313	GCF_000011485.1
1467180	RefSeq	NZ_LVHP01000025.1	466205	468109	-	WP_011130874.1	DNA-directed RNA polymerase subunit gamma	Prochlorococcus marinus str. MIT 1320	MIT 1320	GCF_001632075.1
1467180	Swiss-Prot	N/A				Q7V5P2.1	DNA-directed RNA polymerase subunit gamma	Prochlorococcus marinus str. MIT 9313		
1467180	INSDC	LVHP01000025.1	466205	468109	-	KZR75152.1	DNA-directed RNA polymerase subunit beta'	Prochlorococcus marinus str. MIT 1320	MIT 1320	GCA_001632075.1
