Id	Source	Nucleotide Accession	Start	Stop	Strand	Protein	Protein Name	Organism	Strain	Assembly
1601216	INSDC	BX548175.1	114224	115009	+	CAE20275.1	imidazoleglycerol-phosphate synthase, cyclase subunit	Prochlorococcus marinus str. MIT 9313	MIT9313	GCA_000011485.1
1601216	RefSeq	NC_005071.1	114224	115009	+	WP_011129479.1	HisA/HisF-related TIM barrel protein	Prochlorococcus marinus str. MIT 9313	MIT9313	GCF_000011485.1
1601216	Swiss-Prot	N/A				Q7V958.1	Putative imidazole glycerol phosphate synthase subunit hisF2	Prochlorococcus marinus str. MIT 9313		
1601216	PAT	N/A				AKW56006.1	Sequence 10173 from patent US 8952217	Unknown		
1601216	PAT	HC900020.1	1	786	+	CBN64429.1	unnamed protein product	Prochlorococcus marinus		
