Id	Source	Nucleotide Accession	Start	Stop	Strand	Protein	Protein Name	Organism	Strain	Assembly
1575293	INSDC	BX548175.1	2370712	2372019	+	CAE22418.1	multidrug efflux transporter, MFS family	Prochlorococcus marinus str. MIT 9313	MIT9313	GCA_000011485.1
1575293	RefSeq	NC_005071.1	2370712	2372019	+	WP_011131608.1	tetracycline resistance MFS efflux pump	Prochlorococcus marinus str. MIT 9313	MIT9313	GCF_000011485.1
1575293	RefSeq	NZ_LVHP01000026.1	194851	196158	-	WP_011131608.1	tetracycline resistance MFS efflux pump	Prochlorococcus marinus str. MIT 1320	MIT 1320	GCF_001632075.1
1575293	INSDC	LVHP01000026.1	194851	196158	-	KZR73389.1	Tetracycline resistance protein, class C	Prochlorococcus marinus str. MIT 1320	MIT 1320	GCA_001632075.1
1575293	INSDC	JAZAII010000200.1	1962	3269	+	MED5562453.1	tetracycline resistance MFS efflux pump	Cyanobacteriota bacterium		GCA_036230865.1
