Id	Source	Nucleotide Accession	Start	Stop	Strand	Protein	Protein Name	Organism	Strain	Assembly
1608989	RefSeq	NC_005072.1	99535	100965	-	WP_011131735.1	TolC family protein	Prochlorococcus marinus subsp. pastoris str. CCMP1986	MED4	GCF_000011465.1
1608989	RefSeq	NZ_CP138914.1	996490	997920	-	WP_011131735.1	TolC family protein	Prochlorococcus sp. Dvax-bc1017	Dvax-bc1017	GCF_047302725.1
1608989	RefSeq	NZ_CP138922.1	1175069	1176499	+	WP_011131735.1	TolC family protein	Prochlorococcus marinus subsp. pastoris str. CCMP1986	MED4x	GCF_047497115.1
1608989	RefSeq	NZ_CP138923.1	1345564	1346994	+	WP_011131735.1	TolC family protein	Prochlorococcus marinus subsp. pastoris str. CCMP1986	MED4ax	GCF_047497125.1
1608989	RefSeq	NZ_CP138976.1	529831	531261	+	WP_011131735.1	TolC family protein	Prochlorococcus sp. MED1	MED1	GCF_047305115.1
1608989	RefSeq	NZ_JNAG01000002.1	115765	117195	+	WP_011131735.1	TolC family protein	Prochlorococcus marinus str. EQPAC1	EQPAC1	GCF_000759875.1
1608989	INSDC	BX548174.1	99535	100965	-	CAE18556.1	possible RND family outer membrane efflux protein	Prochlorococcus marinus subsp. pastoris str. CCMP1986	MED4	GCA_000011465.1
1608989	INSDC	JNAG01000002.1	115765	117195	+	KGF88150.1	Outer membrane efflux protein precursor	Prochlorococcus marinus str. EQPAC1	EQPAC1	GCA_000759875.1
