SeqID	Localization	Score
WP_049587627.1 MULTISPECIES: LysR family transcriptional regulator [Alteromonas]	Cytoplasmic	9.26
WP_049587629.1 MULTISPECIES: rhodanese-like domain-containing protein [Alteromonas]	Unknown	2.00
WP_049587631.1 MULTISPECIES: PRC-barrel domain-containing protein [Alteromonas]	Cytoplasmic	8.96
WP_049587633.1 MULTISPECIES: DUF413 domain-containing protein [Alteromonas]	Unknown	2.00
WP_049587635.1 MULTISPECIES: LysR family transcriptional regulator [Alteromonas]	Cytoplasmic	9.97
WP_049587740.1 MULTISPECIES: hypothetical protein [Alteromonas]	Cytoplasmic	8.96
WP_049587853.1 tetraacyldisaccharide 4'-kinase [Alteromonas macleodii]	Cytoplasmic	8.96
WP_049587884.1 FAD binding domain-containing protein [Alteromonas macleodii]	Cytoplasmic	9.26
WP_049588047.1 MULTISPECIES: sigma-54-dependent transcriptional regulator [Alteromonas]	Cytoplasmic	9.97
WP_049588114.1 MULTISPECIES: OapA family protein [Alteromonas]	Unknown	2.00
WP_049588167.1 MULTISPECIES: PepSY-associated TM helix domain-containing protein [Alteromonas]	CytoplasmicMembrane	10.00
WP_049588169.1 MULTISPECIES: hypothetical protein [Alteromonas]	CytoplasmicMembrane	10.00
WP_049588184.1 MULTISPECIES: NADP-specific glutamate dehydrogenase [Gammaproteobacteria]	Unknown	4.74
WP_049588260.1 MULTISPECIES: LPS export ABC transporter permease LptF [Alteromonas]	CytoplasmicMembrane	10.00
WP_049588357.1 MULTISPECIES: VOC family protein [Alteromonas]	Unknown	2.00
WP_049588368.1 MULTISPECIES: alanine racemase [Alteromonas]	Unknown	4.99
WP_049588369.1 MULTISPECIES: YitT family protein [Alteromonas]	CytoplasmicMembrane	10.00
WP_049588660.1 MULTISPECIES: outer membrane protein assembly factor BamC [Alteromonas]	OuterMembrane	9.92
WP_049588668.1 MULTISPECIES: alanine dehydrogenase [Alteromonas]	Cytoplasmic	9.97
WP_049588764.1 MULTISPECIES: substrate-binding periplasmic protein [Alteromonas]	Unknown	2.50
WP_049588829.1 MULTISPECIES: response regulator transcription factor [Alteromonas]	Cytoplasmic	9.97
WP_049588960.1 MULTISPECIES: DUF3291 domain-containing protein [Alteromonas]	Cytoplasmic	8.96
WP_049588966.1 MULTISPECIES: hypothetical protein [Alteromonas]	CytoplasmicMembrane	9.86
WP_049588989.1 MULTISPECIES: energy transducer TonB [Alteromonas]	Unknown	4.90
WP_049588997.1 MULTISPECIES: pantoate--beta-alanine ligase [Alteromonas]	Cytoplasmic	9.97
WP_049589099.1 MULTISPECIES: pyridoxamine 5'-phosphate oxidase family protein [Alteromonas]	Unknown	2.00
WP_052247334.1 peptidoglycan DD-metalloendopeptidase family protein [Alteromonas macleodii]	OuterMembrane	9.92
WP_052247338.1 MULTISPECIES: 30S ribosomal protein S17 [Alteromonas]	Cytoplasmic	8.96
WP_052247339.1 MULTISPECIES: replication initiation factor domain-containing protein [Alteromonas]	Cytoplasmic	8.96
WP_053103822.1 MULTISPECIES: ArsR/SmtB family transcription factor [Alteromonas]	Cytoplasmic	8.96
WP_053103825.1 MULTISPECIES: transposase [Gammaproteobacteria]	Unknown	2.00
WP_061093927.1 MULTISPECIES: hypothetical protein [Alteromonas/Salinimonas group]	Unknown	2.00
WP_061094262.1 MULTISPECIES: KpsF/GutQ family sugar-phosphate isomerase [Alteromonas]	Unknown	2.00
WP_061094420.1 MULTISPECIES: membrane-bound lytic murein transglycosylase MltF [Alteromonas]	Cytoplasmic	9.26
WP_061094557.1 MULTISPECIES: 50S ribosomal protein L3 N(5)-glutamine methyltransferase [Alteromonas]	Cytoplasmic	9.97
WP_061094604.1 MULTISPECIES: alpha/beta hydrolase [Alteromonas]	Unknown	2.50
WP_061094605.1 MULTISPECIES: efflux RND transporter permease subunit [Alteromonas]	CytoplasmicMembrane	10.00
WP_061094643.1 MULTISPECIES: FecCD family ABC transporter permease [Alteromonas]	CytoplasmicMembrane	10.00
WP_061094802.1 MULTISPECIES: SufE family protein [Alteromonas]	Cytoplasmic	9.26
WP_061095258.1 MULTISPECIES: M14 family metallopeptidase [Alteromonas]	Cytoplasmic	9.26
WP_061095336.1 MULTISPECIES: Hg(II)-responsive transcriptional regulator [Gammaproteobacteria]	Cytoplasmic	9.97
WP_061095484.1 MULTISPECIES: 4-hydroxy-3-methylbut-2-enyl diphosphate reductase [Alteromonas]	Cytoplasmic	9.97
WP_061095598.1 MULTISPECIES: NO-inducible flavohemoprotein [Alteromonas]	Cytoplasmic	9.97
WP_061095648.1 MULTISPECIES: retropepsin-like aspartic protease [Alteromonas]	CytoplasmicMembrane	9.86
WP_061095772.1 MULTISPECIES: bifunctional 2-methylcitrate synthase/citrate synthase [Alteromonas]	Cytoplasmic	9.97
WP_061095773.1 MULTISPECIES: Fe/S-dependent 2-methylisocitrate dehydratase AcnD [Alteromonas]	Cytoplasmic	9.97
WP_061096005.1 MULTISPECIES: DUF4258 domain-containing protein [Alteromonas]	Unknown	2.00
WP_061096048.1 MULTISPECIES: hypothetical protein [Alteromonas]	CytoplasmicMembrane	9.46
WP_061096100.1 MULTISPECIES: TonB-dependent receptor [Alteromonas]	OuterMembrane	10.00
WP_061096130.1 MULTISPECIES: NADP-dependent oxidoreductase [Alteromonas]	Cytoplasmic	9.97
WP_061096318.1 MULTISPECIES: hypothetical protein [Alteromonas]	CytoplasmicMembrane	10.00
WP_061438871.1 MULTISPECIES: methionyl-tRNA formyltransferase [Alteromonas]	Cytoplasmic	9.97
WP_061438894.1 MULTISPECIES: DUF1820 family protein [Alteromonas]	Cytoplasmic	8.96
WP_061439146.1 MULTISPECIES: efflux RND transporter permease subunit [Alteromonas]	CytoplasmicMembrane	10.00
WP_061439208.1 cation:proton antiporter [Alteromonas macleodii]	CytoplasmicMembrane	10.00
WP_061439217.1 MULTISPECIES: DNA topoisomerase IV subunit A [Alteromonas]	Cytoplasmic	9.12
WP_061439267.1 MULTISPECIES: glycerophosphodiester phosphodiesterase [Alteromonas]	Cytoplasmic	9.26
WP_061439275.1 MULTISPECIES: Ppx/GppA phosphatase family protein [Alteromonas]	Cytoplasmic	9.97
WP_061439278.1 MULTISPECIES: amidohydrolase [Alteromonas]	Unknown	4.90
WP_061439280.1 ATP-binding protein [Alteromonas macleodii]	CytoplasmicMembrane	10.00
WP_061439282.1 MULTISPECIES: 5-(carboxyamino)imidazole ribonucleotide synthase [Alteromonas]	CytoplasmicMembrane	7.88
WP_061439284.1 copper chaperone PCu(A)C [Alteromonas macleodii]	Unknown	2.00
WP_061439286.1 MULTISPECIES: PQQ-dependent sugar dehydrogenase [Alteromonas]	Unknown	4.90
WP_061439288.1 S9 family peptidase [Alteromonas macleodii]	Unknown	6.49
WP_061439325.1 MULTISPECIES: GNAT family N-acetyltransferase [Alteromonas]	Unknown	2.00
WP_061439330.1 MULTISPECIES: YnfA family protein [Alteromonas]	CytoplasmicMembrane	10.00
WP_061484788.1 MULTISPECIES: transketolase [Alteromonas]	Cytoplasmic	9.26
WP_061484792.1 MULTISPECIES: ABC transporter permease subunit [Alteromonas]	CytoplasmicMembrane	10.00
WP_061484952.1 MULTISPECIES: ABC transporter ATP-binding protein [Alteromonas]	CytoplasmicMembrane	9.82
WP_061485124.1 MULTISPECIES: DUF2891 domain-containing protein [Alteromonas]	Unknown	4.90
WP_061485140.1 MULTISPECIES: pseudouridine synthase [Alteromonas]	Cytoplasmic	9.26
WP_061485157.1 MULTISPECIES: electron transport complex subunit RsxD [Alteromonas]	CytoplasmicMembrane	10.00
WP_061485169.1 MULTISPECIES: DUF3025 domain-containing protein [Alteromonas]	Unknown	2.00
WP_061485238.1 MULTISPECIES: sensor histidine kinase [Alteromonas]	CytoplasmicMembrane	7.88
WP_061485262.1 MULTISPECIES: patatin-like phospholipase family protein [Alteromonas]	Unknown	2.00
WP_061485322.1 MULTISPECIES: ABC transporter ATP-binding protein [Alteromonas]	CytoplasmicMembrane	9.99
WP_061485368.1 MULTISPECIES: nucleotide exchange factor GrpE [Alteromonas]	Cytoplasmic	9.97
WP_061485376.1 MULTISPECIES: propionyl-CoA synthetase [Alteromonas]	Cytoplasmic	9.97
WP_061485531.1 MULTISPECIES: two-component system response regulator [Alteromonas]	CytoplasmicMembrane	7.88
WP_061485590.1 MULTISPECIES: transglutaminase-like cysteine peptidase [Alteromonas]	Cytoplasmic	8.96
WP_061485773.1 ABC transporter permease [Alteromonas macleodii]	CytoplasmicMembrane	10.00
WP_061485774.1 MULTISPECIES: ABC transporter ATP-binding protein [Alteromonas]	CytoplasmicMembrane	10.00
WP_061485776.1 MULTISPECIES: hypothetical protein [Alteromonas]	Cytoplasmic	8.96
WP_061485777.1 MULTISPECIES: hypothetical protein [Alteromonas]	Cytoplasmic	8.96
WP_061485778.1 MULTISPECIES: site-specific integrase [Alteromonas]	Cytoplasmic	8.96
WP_061485779.1 MULTISPECIES: hypothetical protein [Alteromonas]	Unknown	2.00
WP_061485780.1 MULTISPECIES: hypothetical protein [Alteromonas]	Cytoplasmic	8.96
WP_061485783.1 MULTISPECIES: replication endonuclease [Alteromonas]	Cytoplasmic	8.96
WP_061485785.1 MULTISPECIES: RnfH family protein [Alteromonas]	Cytoplasmic	8.96
WP_061485908.1 MULTISPECIES: glutaredoxin family protein [Alteromonas]	Unknown	2.00
WP_061485913.1 MULTISPECIES: DUF2254 domain-containing protein [Alteromonas]	CytoplasmicMembrane	10.00
WP_061485948.1 MULTISPECIES: arsenate reductase (glutaredoxin) [Alteromonas]	Cytoplasmic	9.97
WP_061485949.1 MULTISPECIES: NAD(P)H:quinone oxidoreductase [Alteromonas]	Unknown	2.00
WP_061485957.1 MULTISPECIES: molybdopterin molybdotransferase MoeA [Alteromonas]	Cytoplasmic	9.97
WP_061485958.1 MULTISPECIES: MATE family efflux transporter [Alteromonas]	CytoplasmicMembrane	10.00
WP_061485959.1 MULTISPECIES: nucleotidyltransferase family protein [Alteromonas]	Unknown	2.00
WP_061485960.1 vWA domain-containing protein [Alteromonas macleodii]	Cytoplasmic	9.97
WP_061485961.1 MULTISPECIES: cysteine synthase A [Alteromonas]	Cytoplasmic	9.26
WP_061485967.1 MULTISPECIES: IS110 family RNA-guided transposase [Alteromonas]	Cytoplasmic	8.96
WP_061485979.1 MULTISPECIES: rhombosortase [Alteromonas]	CytoplasmicMembrane	10.00
WP_061485981.1 MULTISPECIES: FMN-dependent NADH-azoreductase [Alteromonas]	Cytoplasmic	9.26
WP_061485992.1 H-NS histone family protein [Alteromonas macleodii]	Cytoplasmic	9.97
WP_061486045.1 MULTISPECIES: UxaA family hydrolase [Alteromonas]	Unknown	2.00
WP_061486054.1 MULTISPECIES: ExeM/NucH family extracellular endonuclease [Alteromonas]	OuterMembrane	9.52
WP_061486055.1 MULTISPECIES: methyl-accepting chemotaxis protein [Alteromonas]	CytoplasmicMembrane	9.97
WP_061486056.1 MULTISPECIES: type 1 glutamine amidotransferase domain-containing protein [Alteromonas]	Periplasmic	9.99
WP_061486058.1 MULTISPECIES: alpha/beta fold hydrolase [Alteromonas]	Periplasmic	9.44
WP_061486059.1 MULTISPECIES: helix-turn-helix domain-containing protein [Alteromonas]	Unknown	2.00
WP_061486063.1 MULTISPECIES: hypothetical protein [Alteromonas]	Unknown	2.00
WP_061486065.1 MULTISPECIES: hypothetical protein [Alteromonas]	Unknown	2.00
WP_061486066.1 MULTISPECIES: hypothetical protein [Alteromonas]	Unknown	2.00
WP_061486067.1 MULTISPECIES: recombinase family protein [Alteromonas]	Cytoplasmic	8.96
WP_061486068.1 MULTISPECIES: SLC13 family permease [Alteromonas]	CytoplasmicMembrane	10.00
WP_061486069.1 MULTISPECIES: iron-sulfur cluster carrier protein ApbC [Alteromonas]	CytoplasmicMembrane	9.82
WP_061486070.1 MULTISPECIES: mechanosensitive ion channel family protein [Alteromonas]	CytoplasmicMembrane	10.00
WP_061486071.1 MULTISPECIES: lytic transglycosylase [Alteromonas]	Cytoplasmic	8.96
WP_061486072.1 MULTISPECIES: hypothetical protein [Alteromonas]	CytoplasmicMembrane	9.27
WP_061486073.1 citrulline utilization hydrolase CtlX [Alteromonas macleodii]	Cytoplasmic	9.97
WP_061486074.1 MULTISPECIES: cysteine--tRNA ligase [Alteromonas]	Cytoplasmic	9.97
WP_061486075.1 MULTISPECIES: LysR family transcriptional regulator [Alteromonas]	Cytoplasmic	9.26
WP_061486076.1 MULTISPECIES: SDR family NAD(P)-dependent oxidoreductase [Alteromonas]	Cytoplasmic	9.26
WP_061486078.1 MULTISPECIES: winged helix-turn-helix transcriptional regulator [Alteromonas]	Unknown	2.00
WP_061486079.1 MULTISPECIES: YhdH/YhfP family quinone oxidoreductase [Alteromonas]	Cytoplasmic	9.26
WP_061486080.1 MULTISPECIES: TerC family protein [Alteromonas]	CytoplasmicMembrane	10.00
WP_061486081.1 MULTISPECIES: acyl carrier protein phosphodiesterase [Alteromonas]	Cytoplasmic	8.96
WP_061486082.1 MULTISPECIES: Yip1 family protein [Alteromonas]	CytoplasmicMembrane	10.00
WP_061486083.1 MULTISPECIES: SPOR domain-containing protein [Alteromonas]	Unknown	2.00
WP_061486143.1 MULTISPECIES: farnesyl diphosphate synthase [Alteromonas]	Cytoplasmic	9.26
WP_061486152.1 type IV pilin protein [Alteromonas macleodii]	Unknown	2.00
WP_061486229.1 hypothetical protein [Alteromonas macleodii]	Unknown	2.00
WP_061486350.1 MULTISPECIES: bifunctional helix-turn-helix transcriptional regulator/GNAT family N-acetyltransferase [Alteromonas]	Cytoplasmic	8.96
WP_061486351.1 MULTISPECIES: endonuclease VIII [Alteromonas]	Cytoplasmic	9.97
WP_061486352.1 MULTISPECIES: zinc-binding dehydrogenase [Alteromonas]	Unknown	2.00
WP_061486357.1 MULTISPECIES: ATP-binding protein [Alteromonas]	CytoplasmicMembrane	7.88
WP_061486358.1 MULTISPECIES: PQQ-dependent sugar dehydrogenase [Alteromonas]	Unknown	2.50
WP_061486359.1 MULTISPECIES: hypothetical protein [Alteromonas]	Cytoplasmic	8.96
WP_061486360.1 alpha/beta hydrolase-fold protein [Alteromonas macleodii]	Unknown	2.00
WP_061486361.1 serine hydrolase domain-containing protein [Alteromonas macleodii]	CytoplasmicMembrane	9.97
WP_061486362.1 MULTISPECIES: BRO family protein [Alteromonas]	Cytoplasmic	8.96
WP_061486363.1 MULTISPECIES: DarT ssDNA thymidine ADP-ribosyltransferase family protein [Alteromonas]	Cytoplasmic	8.96
WP_061486365.1 MULTISPECIES: type II toxin-antitoxin system antitoxin DNA ADP-ribosyl glycohydrolase DarG [Alteromonas]	Cytoplasmic	9.97
WP_061486424.1 MULTISPECIES: glutathione S-transferase family protein [Alteromonas]	Cytoplasmic	9.97
WP_061486461.1 MULTISPECIES: 2-methylaconitate cis-trans isomerase PrpF [Alteromonas]	Cytoplasmic	9.26
WP_061486462.1 MULTISPECIES: sodium:solute symporter family transporter [Alteromonas]	CytoplasmicMembrane	10.00
WP_061486463.1 MULTISPECIES: PH domain-containing protein [Alteromonas]	CytoplasmicMembrane	10.00
WP_061486464.1 MULTISPECIES: PH domain-containing protein [Alteromonas]	CytoplasmicMembrane	9.82
WP_061486465.1 MULTISPECIES: M20/M25/M40 family metallo-hydrolase [Alteromonas]	Unknown	2.00
WP_061486466.1 MULTISPECIES: cobalamin biosynthesis protein CobD/CbiB [Alteromonas]	CytoplasmicMembrane	10.00
WP_061486471.1 MULTISPECIES: ArsB/NhaD family transporter [Alteromonas]	CytoplasmicMembrane	10.00
WP_061486472.1 MULTISPECIES: L-fucose:H+ symporter permease [Alteromonas]	CytoplasmicMembrane	10.00
WP_061486473.1 alkene reductase [Alteromonas macleodii]	Cytoplasmic	9.26
WP_061486474.1 MULTISPECIES: trans-sulfuration enzyme family protein [Alteromonas]	Cytoplasmic	9.54
WP_061486475.1 D-2-hydroxyacid dehydrogenase [Alteromonas macleodii]	Cytoplasmic	9.26
WP_061486476.1 glutathione S-transferase family protein [Alteromonas macleodii]	Unknown	2.00
WP_061486477.1 MULTISPECIES: polyphosphate kinase 2 family protein [Alteromonas]	Cytoplasmic	9.97
WP_061486478.1 septum site-determining protein MinD [Alteromonas macleodii]	Cytoplasmic	9.12
WP_061486479.1 septum site-determining protein MinC [Alteromonas macleodii]	Cytoplasmic	9.26
WP_061486480.1 hypothetical protein [Alteromonas macleodii]	Unknown	2.00
WP_061486481.1 putative manganese transporter [Alteromonas macleodii]	CytoplasmicMembrane	10.00
WP_061486482.1 Nramp family divalent metal transporter [Alteromonas macleodii]	CytoplasmicMembrane	10.00
WP_061486490.1 anti-sigma factor [Alteromonas macleodii]	Unknown	2.00
WP_061486491.1 DUF4331 domain-containing protein [Alteromonas macleodii]	Unknown	2.50
WP_061486492.1 Ig-like domain-containing protein [Alteromonas macleodii]	Unknown	2.00
WP_061486494.1 HupE/UreJ family protein [Alteromonas macleodii]	CytoplasmicMembrane	10.00
WP_061486528.1 MULTISPECIES: sensor histidine kinase [Alteromonas]	CytoplasmicMembrane	7.88
WP_061486659.1 hypothetical protein [Alteromonas macleodii]	Unknown	2.50
WP_061486708.1 MULTISPECIES: ABC transporter ATP-binding protein [Alteromonas]	CytoplasmicMembrane	10.00
WP_061486709.1 MULTISPECIES: RraA family protein [Alteromonas]	Cytoplasmic	8.96
WP_061486710.1 MULTISPECIES: M13 family metallopeptidase [Alteromonas]	Unknown	6.49
WP_061486711.1 MULTISPECIES: lysoplasmalogenase [Alteromonas]	CytoplasmicMembrane	10.00
WP_061486712.1 MULTISPECIES: ACT domain-containing protein [Alteromonas]	Unknown	2.00
WP_061486719.1 MULTISPECIES: agmatine deiminase family protein [Alteromonas]	Cytoplasmic	9.97
WP_061486757.1 sigma-54 interaction domain-containing protein [Alteromonas macleodii]	Cytoplasmic	9.97
WP_061486807.1 MULTISPECIES: 50S ribosomal protein L11 methyltransferase [Alteromonas]	Cytoplasmic	9.97
WP_061486814.1 MULTISPECIES: phosphoenolpyruvate carboxykinase [Alteromonas]	Cytoplasmic	9.97
WP_061486815.1 MULTISPECIES: type II secretion system protein GspC [Alteromonas]	CytoplasmicMembrane	9.82
WP_061486816.1 MULTISPECIES: type II secretion system ATPase GspE [Alteromonas]	Cytoplasmic	9.97
WP_061486817.1 type II secretion system inner membrane protein GspF [Alteromonas macleodii]	CytoplasmicMembrane	10.00
WP_061486818.1 MULTISPECIES: type II secretion system major pseudopilin GspG [Alteromonas]	CytoplasmicMembrane	9.82
WP_061486819.1 MULTISPECIES: type II secretion system minor pseudopilin GspH [Alteromonas]	CytoplasmicMembrane	9.97
WP_061486866.1 MULTISPECIES: GH1 family beta-glucosidase [Alteromonas]	Cytoplasmic	9.97
WP_061486878.1 MULTISPECIES: tRNA uridine-5-carboxymethylaminomethyl(34) synthesis GTPase MnmE [Alteromonas]	Cytoplasmic	9.97
WP_061486880.1 MULTISPECIES: membrane protein insertase YidC [Alteromonas]	CytoplasmicMembrane	10.00
WP_061486897.1 MULTISPECIES: hypothetical protein [Gammaproteobacteria]	Unknown	2.00
WP_061486964.1 MULTISPECIES: leucyl/phenylalanyl-tRNA--protein transferase [Alteromonas]	Cytoplasmic	9.26
WP_061486983.1 MULTISPECIES: hypothetical protein [Alteromonas]	Cytoplasmic	8.96
WP_061486984.1 MULTISPECIES: zinc-binding alcohol dehydrogenase family protein [Alteromonas]	Cytoplasmic	9.97
WP_061487001.1 DUF6776 family protein [Alteromonas macleodii]	Unknown	2.00
WP_061487024.1 MULTISPECIES: RHS repeat-associated core domain-containing protein [Alteromonas]	OuterMembrane	9.49
WP_061487031.1 MULTISPECIES: tyrosine-type recombinase/integrase [Alteromonas]	Cytoplasmic	8.96
WP_061487042.1 MULTISPECIES: hypothetical protein [Alteromonas]	CytoplasmicMembrane	10.00
WP_061487045.1 MULTISPECIES: hypothetical protein [Alteromonas]	CytoplasmicMembrane	10.00
WP_061487048.1 MULTISPECIES: ParB/RepB/Spo0J family partition protein [Alteromonas]	Cytoplasmic	8.96
WP_061487054.1 MULTISPECIES: hypothetical protein [Alteromonas]	Unknown	2.00
WP_061487056.1 MULTISPECIES: hypothetical protein [Alteromonas]	Unknown	2.00
WP_061487057.1 MULTISPECIES: hypothetical protein [Alteromonas]	CytoplasmicMembrane	9.82
WP_061487065.1 MULTISPECIES: hypothetical protein [Alteromonas]	Unknown	2.00
WP_061487066.1 MULTISPECIES: recombinase family protein [Alteromonadales]	Cytoplasmic	8.96
WP_061487068.1 MULTISPECIES: ExeA family protein [Alteromonadales]	Cytoplasmic	9.97
WP_061487069.1 MULTISPECIES: hypothetical protein [Alteromonadales]	Unknown	2.00
WP_061487076.1 MULTISPECIES: IS630 family transposase [Alteromonas]	Cytoplasmic	8.96
WP_061487078.1 MULTISPECIES: hypothetical protein [Alteromonas]	Unknown	2.00
WP_061487080.1 MULTISPECIES: hypothetical protein [Alteromonas]	Unknown	2.00
WP_069943465.1 MULTISPECIES: 16S rRNA (cytosine(967)-C(5))-methyltransferase RsmB [Alteromonas]	Cytoplasmic	9.26
WP_069943519.1 MULTISPECIES: MauE/DoxX family redox-associated membrane protein [Alteromonas]	CytoplasmicMembrane	10.00
WP_069943528.1 MULTISPECIES: LPS translocon maturation chaperone LptM [Alteromonas]	Unknown	2.00
WP_069943536.1 MULTISPECIES: MFS transporter [Alteromonas]	CytoplasmicMembrane	10.00
WP_069943591.1 MULTISPECIES: LacI family DNA-binding transcriptional regulator [Alteromonas]	Cytoplasmic	9.26
WP_069943593.1 MULTISPECIES: trehalase family glycosidase [Alteromonas]	Cytoplasmic	9.26
WP_069943594.1 MULTISPECIES: GGDEF domain-containing protein [Alteromonas]	CytoplasmicMembrane	9.86
WP_069943595.1 MULTISPECIES: HAD family hydrolase [Alteromonas]	Cytoplasmic	9.26
WP_069943596.1 MULTISPECIES: sugar phosphate isomerase/epimerase family protein [Alteromonas]	Cytoplasmic	8.96
WP_069943597.1 MULTISPECIES: Gfo/Idh/MocA family protein [Alteromonas]	Unknown	5.41
WP_069943598.1 MULTISPECIES: sugar phosphate isomerase/epimerase family protein [Alteromonas]	Cytoplasmic	8.96
WP_069943612.1 Dam family site-specific DNA-(adenine-N6)-methyltransferase [Alteromonas macleodii]	Unknown	2.00
WP_069943627.1 MULTISPECIES: N-acetyl-gamma-glutamyl-phosphate reductase [Alteromonas]	Cytoplasmic	9.26
WP_069943747.1 MULTISPECIES: acyl-CoA dehydrogenase family protein [Alteromonas]	Cytoplasmic	9.26
WP_069943748.1 MULTISPECIES: SDR family NAD(P)-dependent oxidoreductase [Alteromonas]	Cytoplasmic	9.97
WP_069943754.1 MULTISPECIES: 2-amino-4-hydroxy-6-hydroxymethyldihydropteridine diphosphokinase [Alteromonas]	Cytoplasmic	9.26
WP_069943755.1 MULTISPECIES: dipeptidyl-peptidase 3 family protein [Alteromonas]	Unknown	4.90
WP_069943783.1 MULTISPECIES: NAD(P)H-dependent oxidoreductase [Alteromonas]	Cytoplasmic	8.96
WP_069943850.1 MULTISPECIES: redoxin family protein [Alteromonas]	CytoplasmicMembrane	9.82
WP_069943851.1 MULTISPECIES: cytochrome c-type biogenesis protein [Alteromonas]	CytoplasmicMembrane	10.00
WP_069943852.1 MULTISPECIES: c-type cytochrome biogenesis protein CcmI [Alteromonas]	CytoplasmicMembrane	9.82
WP_069943853.1 MULTISPECIES: MlaA family lipoprotein [Alteromonas]	OuterMembrane	8.28
WP_069943855.1 peptide MFS transporter [Alteromonas macleodii]	CytoplasmicMembrane	10.00
WP_069943856.1 MULTISPECIES: capsule biosynthesis protein [Alteromonas]	Unknown	2.00
WP_069943857.1 MULTISPECIES: glycosyltransferase family 2 protein [Alteromonas]	Unknown	2.00
WP_069943859.1 MULTISPECIES: histidine kinase [Alteromonas]	Unknown	2.00
WP_069943860.1 MULTISPECIES: SecY-interacting protein [Alteromonas]	CytoplasmicMembrane	9.82
WP_069943862.1 MULTISPECIES: DUF3301 domain-containing protein [Alteromonas]	Unknown	2.00
WP_069943863.1 MULTISPECIES: DUF3549 family protein [Alteromonas]	Unknown	2.00
WP_069943864.1 MULTISPECIES: flavodoxin domain-containing protein [Alteromonas]	Cytoplasmic	8.96
WP_069943866.1 MULTISPECIES: phosphatidate cytidylyltransferase [Alteromonas]	CytoplasmicMembrane	10.00
WP_069943867.1 MULTISPECIES: 1-deoxy-D-xylulose-5-phosphate reductoisomerase [Alteromonas]	Cytoplasmic	8.96
WP_069943882.1 flagellar assembly peptidoglycan hydrolase FlgJ [Alteromonas macleodii]	Periplasmic	9.44
WP_069943884.1 MULTISPECIES: Kelch repeat-containing protein [Alteromonas]	Unknown	2.00
WP_069943885.1 MULTISPECIES: flagellar protein FlaG [Alteromonas]	Unknown	2.00
WP_069943895.1 MULTISPECIES: SDR family oxidoreductase [Alteromonas]	Cytoplasmic	9.26
WP_069943898.1 MULTISPECIES: GDP-mannose 4,6-dehydratase [Alteromonas]	Cytoplasmic	9.97
WP_069943923.1 MULTISPECIES: sodium ion-translocating decarboxylase subunit beta [Alteromonas]	CytoplasmicMembrane	10.00
WP_069943945.1 MULTISPECIES: SDR family oxidoreductase [Alteromonas]	Cytoplasmic	9.26
WP_069943947.1 MULTISPECIES: RnfABCDGE type electron transport complex subunit G [Alteromonas]	Unknown	2.00
WP_069943948.1 MULTISPECIES: electron transport complex subunit RsxC [Alteromonas]	Extracellular	9.52
WP_069943950.1 MULTISPECIES: M28 family metallopeptidase [Alteromonas]	Extracellular	9.71
WP_069943989.1 MULTISPECIES: sensor domain-containing diguanylate cyclase [Alteromonas]	CytoplasmicMembrane	7.88
WP_069943990.1 MULTISPECIES: hypothetical protein [Alteromonas]	Unknown	2.50
WP_069944025.1 MULTISPECIES: PHP domain-containing protein [Alteromonas]	Cytoplasmic	9.97
WP_069944046.1 MULTISPECIES: acyl-CoA thioesterase [Alteromonas]	Unknown	2.00
WP_069944084.1 MULTISPECIES: diguanylate cyclase [Alteromonas]	Cytoplasmic	9.97
WP_069944128.1 MULTISPECIES: FIST signal transduction protein [Alteromonas]	Unknown	2.00
WP_069944131.1 acetyl/propionyl/methylcrotonyl-CoA carboxylase subunit alpha [Alteromonas macleodii]	Cytoplasmic	9.26
WP_069944132.1 MULTISPECIES: carboxyl transferase domain-containing protein [Alteromonas]	Cytoplasmic	9.97
WP_069944133.1 MULTISPECIES: isovaleryl-CoA dehydrogenase [Alteromonas]	Cytoplasmic	9.97
WP_069944135.1 MULTISPECIES: diguanylate cyclase [Alteromonas]	Cytoplasmic	8.96
WP_069944136.1 MULTISPECIES: exodeoxyribonuclease I [Alteromonas]	Cytoplasmic	9.97
WP_069944137.1 MULTISPECIES: ATP-binding protein [Alteromonas]	CytoplasmicMembrane	10.00
WP_069944138.1 MULTISPECIES: isoaspartyl peptidase/L-asparaginase family protein [Alteromonas]	Periplasmic	9.76
WP_069944203.1 MULTISPECIES: hypothetical protein [Alteromonas]	Unknown	2.00
WP_069944206.1 MULTISPECIES: (2Fe-2S)-binding protein [Alteromonas]	Cytoplasmic	9.26
WP_069944209.1 MULTISPECIES: adenylate/guanylate cyclase domain-containing protein [Alteromonas]	Unknown	2.00
WP_069944210.1 MULTISPECIES: adenylosuccinate lyase [Alteromonas]	Cytoplasmic	9.97
WP_069944211.1 tRNA 2-thiouridine(34) synthase MnmA [Alteromonas macleodii]	Cytoplasmic	9.97
WP_069944212.1 MULTISPECIES: NADP-dependent isocitrate dehydrogenase [Alteromonas]	Cytoplasmic	9.97
WP_069944220.1 MULTISPECIES: prolyl hydroxylase family protein [Alteromonas]	Unknown	2.00
WP_069944237.1 MULTISPECIES: hypothetical protein [Alteromonas]	Unknown	2.00
WP_069944245.1 MULTISPECIES: alpha/beta hydrolase family protein [Alteromonas]	Unknown	2.50
WP_069944251.1 MULTISPECIES: arginyltransferase [Alteromonas]	Cytoplasmic	9.26
WP_069944252.1 MULTISPECIES: thioredoxin-disulfide reductase [Alteromonas]	Unknown	4.99
WP_069944254.1 MULTISPECIES: asparaginase [Alteromonas]	Cytoplasmic	9.97
WP_069944281.1 MULTISPECIES: hypothetical protein [Alteromonas]	Unknown	2.50
WP_069944282.1 CcdB family protein [Alteromonas macleodii]	Unknown	2.00
WP_069944283.1 transposase [Alteromonas macleodii]	Cytoplasmic	8.96
WP_069944285.1 MULTISPECIES: phospholipase D-like domain-containing protein [Alteromonadales]	Unknown	2.00
WP_069944286.1 MULTISPECIES: DEAD/DEAH box helicase family protein [Alteromonas]	Unknown	5.48
WP_069944287.1 MULTISPECIES: PhzF family phenazine biosynthesis protein [Alteromonas]	Cytoplasmic	9.97
WP_069944289.1 MULTISPECIES: uracil-DNA glycosylase family protein [Alteromonas]	Unknown	2.00
