SeqID	Localization	Score
WP_014951105.1 MULTISPECIES: secondary thiamine-phosphate synthase enzyme YjbQ [Alteromonas]	Unknown	2.00
WP_014951106.1 MULTISPECIES: OmpA family protein [Alteromonas]	OuterMembrane	9.93
WP_014951107.1 MULTISPECIES: replicative DNA helicase [Alteromonas]	Cytoplasmic	9.97
WP_014951108.1 MULTISPECIES: hypothetical protein [Alteromonas]	Unknown	2.00
WP_014951111.1 MULTISPECIES: RNA polymerase sigma factor [Alteromonas]	Cytoplasmic	9.97
WP_014951120.1 MULTISPECIES: 30S ribosomal protein S6 [Alteromonas]	Cytoplasmic	9.97
WP_014951121.1 MULTISPECIES: YebG family protein [Alteromonas]	Unknown	2.00
WP_014951135.1 MULTISPECIES: solute:sodium symporter family transporter [Alteromonas]	CytoplasmicMembrane	10.00
WP_014951145.1 MULTISPECIES: LacI family DNA-binding transcriptional regulator [Alteromonas]	Cytoplasmic	9.97
WP_014951149.1 MULTISPECIES: cytochrome bd-I oxidase subunit CydX [Alteromonas]	CytoplasmicMembrane	9.82
WP_014951154.1 MULTISPECIES: hypothetical protein [Alteromonas]	Unknown	2.50
WP_014951157.1 hypothetical protein [Alteromonas macleodii]	Unknown	2.00
WP_014951160.1 MULTISPECIES: c-type cytochrome [Alteromonas]	Periplasmic	10.00
WP_014951166.1 MULTISPECIES: GTP cyclohydrolase FolE2 [Alteromonas]	Cytoplasmic	8.96
WP_014951170.1 MULTISPECIES: DUF3299 domain-containing protein [Alteromonas]	CytoplasmicMembrane	9.86
WP_014951177.1 MULTISPECIES: CsbD family protein [Alteromonas]	Unknown	2.00
WP_014951185.1 MULTISPECIES: alternative ribosome rescue aminoacyl-tRNA hydrolase ArfB [Alteromonas]	Unknown	2.00
WP_014951186.1 MULTISPECIES: alpha/beta fold hydrolase [Alteromonas]	CytoplasmicMembrane	9.82
WP_014951188.1 MULTISPECIES: hypothetical protein [Alteromonas]	Unknown	2.00
WP_014951190.1 hypothetical protein [Alteromonas macleodii]	Unknown	2.00
WP_014951191.1 MULTISPECIES: cytochrome b [Alteromonas]	CytoplasmicMembrane	10.00
WP_014951192.1 MULTISPECIES: YceI family protein [Alteromonas]	Unknown	2.50
WP_014951195.1 MULTISPECIES: DUF2721 domain-containing protein [Alteromonas]	CytoplasmicMembrane	10.00
WP_014951198.1 MULTISPECIES: OmpP1/FadL family transporter [Alteromonas]	OuterMembrane	10.00
WP_014951234.1 MULTISPECIES: glutamine--fructose-6-phosphate transaminase (isomerizing) [Alteromonas]	Cytoplasmic	9.97
WP_014951236.1 MULTISPECIES: Gfo/Idh/MocA family oxidoreductase [Alteromonas]	Cytoplasmic	8.96
WP_014951239.1 MULTISPECIES: DMT family transporter [Alteromonas]	CytoplasmicMembrane	10.00
WP_014951242.1 MULTISPECIES: biosynthetic arginine decarboxylase [Alteromonas]	Unknown	5.41
WP_014951244.1 MULTISPECIES: NAD(P)(+) transhydrogenase (Re/Si-specific) subunit beta [Alteromonas]	CytoplasmicMembrane	10.00
WP_014951245.1 MULTISPECIES: NAD(P) transhydrogenase subunit alpha [Alteromonas]	CytoplasmicMembrane	10.00
WP_014951248.1 tryptophan halogenase family protein [Alteromonas macleodii]	Cytoplasmic	8.96
WP_014951249.1 MULTISPECIES: SapC family protein [Alteromonas]	Unknown	2.00
WP_014951250.1 DUF6445 family protein [Alteromonas macleodii]	Unknown	2.00
WP_014951251.1 DUF2271 domain-containing protein [Alteromonas macleodii]	OuterMembrane	9.52
WP_014951252.1 CREC-EF hand family protein [Alteromonas macleodii]	Unknown	4.90
WP_014951253.1 DUF4198 domain-containing protein [Alteromonas macleodii]	Unknown	2.50
WP_014951268.1 TonB-dependent receptor [Alteromonas macleodii]	OuterMembrane	9.52
WP_014951270.1 MULTISPECIES: chaperonin GroEL [Alteromonas]	Cytoplasmic	9.97
WP_014951271.1 MULTISPECIES: FxsA family protein [Alteromonas]	CytoplasmicMembrane	10.00
WP_014951272.1 MULTISPECIES: divalent-cation tolerance protein CutA [Alteromonas]	Cytoplasmic	9.26
WP_014951273.1 protein-disulfide reductase DsbD [Alteromonas macleodii]	CytoplasmicMembrane	10.00
WP_014951285.1 MULTISPECIES: high-potential iron-sulfur protein [Alteromonas]	Unknown	2.50
WP_014951289.1 MULTISPECIES: tRNA dihydrouridine synthase DusB [Alteromonas]	Cytoplasmic	9.97
WP_014951296.1 MULTISPECIES: phosphoribulokinase [Alteromonas]	Cytoplasmic	8.96
WP_014951299.1 MULTISPECIES: two-component system sensor histidine kinase EnvZ [Alteromonas]	CytoplasmicMembrane	9.82
WP_014951311.1 MULTISPECIES: type II secretion system minor pseudopilin GspI [Alteromonas]	CytoplasmicMembrane	9.97
WP_014951319.1 MULTISPECIES: NAD-dependent succinate-semialdehyde dehydrogenase [Alteromonas]	Cytoplasmic	9.97
WP_014951320.1 MULTISPECIES: inosine/xanthosine triphosphatase [Alteromonas]	Unknown	2.00
WP_014951321.1 MULTISPECIES: GMP/IMP nucleotidase [Alteromonas]	Cytoplasmic	9.97
WP_014951322.1 MULTISPECIES: ADP compounds hydrolase NudE [Alteromonas]	Cytoplasmic	9.97
WP_014951323.1 MULTISPECIES: 3'(2'),5'-bisphosphate nucleotidase CysQ [Alteromonas]	Cytoplasmic	9.97
WP_014951328.1 MULTISPECIES: YheU family protein [Alteromonas]	Unknown	2.00
WP_014951329.1 MULTISPECIES: hydrolase [Alteromonas]	Cytoplasmic	8.96
WP_014951335.1 MULTISPECIES: FKBP-type peptidyl-prolyl cis-trans isomerase [Alteromonas]	Periplasmic	9.76
WP_014951337.1 MULTISPECIES: transcription elongation factor GreB [Alteromonas]	Cytoplasmic	9.97
WP_014951344.1 MULTISPECIES: XylR family transcriptional regulator [Alteromonas]	Cytoplasmic	9.97
WP_014951367.1 MULTISPECIES: ComF family protein [Alteromonas]	Cytoplasmic	9.26
WP_014951369.1 MULTISPECIES: Fe-S biogenesis protein NfuA [Alteromonas]	Cytoplasmic	9.97
WP_014951371.1 MULTISPECIES: aspartate/glutamate racemase family protein [Alteromonas]	Cytoplasmic	8.96
WP_014951372.1 MULTISPECIES: VOC family protein [Alteromonas]	Unknown	2.00
WP_014951376.1 MULTISPECIES: GNAT family N-acetyltransferase [Alteromonas]	Unknown	2.00
WP_014951380.1 MULTISPECIES: hypothetical protein [Alteromonas]	Unknown	2.00
WP_014951381.1 MULTISPECIES: SURF1 family protein [Alteromonas]	Unknown	2.00
WP_014951383.1 MULTISPECIES: cytochrome c oxidase subunit 3 [Alteromonas]	CytoplasmicMembrane	10.00
WP_014951384.1 MULTISPECIES: cytochrome c oxidase assembly protein [Alteromonas]	Unknown	2.00
WP_014951387.1 MULTISPECIES: transcriptional repressor LexA [Alteromonas]	Cytoplasmic	9.97
WP_014951390.1 MULTISPECIES: glycerol-3-phosphate 1-O-acyltransferase PlsB [Alteromonas]	CytoplasmicMembrane	10.00
WP_014951393.1 MULTISPECIES: trimeric intracellular cation channel family protein [Alteromonas]	CytoplasmicMembrane	10.00
WP_014951396.1 MULTISPECIES: ketol-acid reductoisomerase [Alteromonas]	Cytoplasmic	9.97
WP_014951404.1 MULTISPECIES: ABC-F family ATPase [Alteromonas]	Cytoplasmic	9.97
WP_014951406.1 MULTISPECIES: PA2779 family protein [Alteromonas]	Unknown	2.50
WP_014951407.1 MULTISPECIES: PA2778 family cysteine peptidase [Alteromonas]	CytoplasmicMembrane	9.86
WP_014951412.1 MULTISPECIES: RNA polymerase sigma factor [Alteromonas]	Cytoplasmic	9.97
WP_014951413.1 MULTISPECIES: hypothetical protein [Alteromonas]	Unknown	2.00
WP_014951416.1 MULTISPECIES: acyl-CoA thioesterase [Alteromonas]	Cytoplasmic	9.26
WP_014951417.1 MULTISPECIES: glutamate 5-kinase [Alteromonas]	Cytoplasmic	9.26
WP_014951422.1 MULTISPECIES: DUF6482 family protein [Alteromonas]	Unknown	2.00
WP_014951423.1 MULTISPECIES: hypothetical protein [Alteromonas]	CytoplasmicMembrane	9.82
WP_014951428.1 MULTISPECIES: hypothetical protein [Alteromonas]	Unknown	2.00
WP_014951429.1 MULTISPECIES: hypothetical protein [Alteromonas]	Unknown	2.00
WP_014951430.1 MULTISPECIES: sulfurtransferase TusA [Alteromonas]	Cytoplasmic	9.26
WP_014951432.1 MULTISPECIES: ribonuclease PH [Alteromonas]	Cytoplasmic	9.97
WP_014951442.1 MULTISPECIES: OmpA family protein [Alteromonas]	OuterMembrane	10.00
WP_014951445.1 MULTISPECIES: tRNA-uridine aminocarboxypropyltransferase [Alteromonas]	Cytoplasmic	9.26
WP_014951448.1 MULTISPECIES: F0F1 ATP synthase subunit epsilon [Alteromonas]	Cytoplasmic	9.12
WP_014951449.1 MULTISPECIES: F0F1 ATP synthase subunit beta [Alteromonas]	Cytoplasmic	9.12
WP_014951450.1 MULTISPECIES: F0F1 ATP synthase subunit alpha [Alteromonas]	Cytoplasmic	9.97
WP_014951451.1 MULTISPECIES: F0F1 ATP synthase subunit delta [Alteromonas]	Cytoplasmic	9.26
WP_014951452.1 MULTISPECIES: F0F1 ATP synthase subunit B [Alteromonas]	CytoplasmicMembrane	9.82
WP_014951454.1 MULTISPECIES: ParB/RepB/Spo0J family partition protein [Alteromonas]	Cytoplasmic	9.97
WP_014951455.1 MULTISPECIES: ParA family protein [Alteromonas]	CytoplasmicMembrane	7.88
WP_014951456.1 MULTISPECIES: 16S rRNA (guanine(527)-N(7))-methyltransferase RsmG [Alteromonas]	Cytoplasmic	8.96
WP_014951458.1 MULTISPECIES: ATP-binding protein [Alteromonas]	Cytoplasmic	8.96
WP_014951464.1 MULTISPECIES: membrane protein insertion efficiency factor YidD [Alteromonas]	Unknown	2.00
WP_014975247.1 MULTISPECIES: DUF2489 domain-containing protein [Alteromonas]	Cytoplasmic	8.96
WP_014975256.1 MULTISPECIES: DNA topoisomerase family protein [Alteromonas]	Unknown	2.00
WP_014975276.1 MULTISPECIES: chorismate--pyruvate lyase family protein [Alteromonas]	Cytoplasmic	9.26
WP_014975312.1 MULTISPECIES: heme biosynthesis HemY N-terminal domain-containing protein [Alteromonas]	CytoplasmicMembrane	10.00
WP_014975316.1 MULTISPECIES: RidA family protein [Alteromonas]	Cytoplasmic	9.26
WP_014975317.1 MULTISPECIES: tRNA (guanosine(18)-2'-O)-methyltransferase TrmH [Alteromonas]	Cytoplasmic	9.26
WP_014975318.1 MULTISPECIES: ATP-dependent DNA helicase RecG [Alteromonas]	Cytoplasmic	9.97
WP_014975320.1 MULTISPECIES: extracellular solute-binding protein [Alteromonas]	Periplasmic	9.76
WP_014975325.1 hypothetical protein [Alteromonas macleodii]	Unknown	2.50
WP_014975330.1 MULTISPECIES: LysE/ArgO family amino acid transporter [Alteromonas]	CytoplasmicMembrane	10.00
WP_014975343.1 MULTISPECIES: DNA helicase RecQ [Alteromonas]	Cytoplasmic	9.97
WP_014975352.1 MULTISPECIES: diaminopimelate decarboxylase [Alteromonas]	Cytoplasmic	9.97
WP_014975355.1 MULTISPECIES: ABC transporter substrate-binding protein [Alteromonas]	Periplasmic	9.76
WP_014975356.1 MULTISPECIES: S1/P1 nuclease [Alteromonas]	Unknown	2.50
WP_014975360.1 MULTISPECIES: 2OG-Fe(II) oxygenase [Alteromonas]	Cytoplasmic	8.96
WP_014975365.1 MULTISPECIES: excinuclease ABC subunit UvrA [Alteromonas]	Cytoplasmic	9.97
WP_014975374.1 MULTISPECIES: sodium/sugar symporter [Alteromonas]	CytoplasmicMembrane	10.00
WP_014975386.1 MULTISPECIES: type II secretion system F family protein [Alteromonas]	CytoplasmicMembrane	10.00
WP_014975389.1 MULTISPECIES: type II secretion system protein [Alteromonas]	Unknown	2.00
WP_014975390.1 MULTISPECIES: type IV pilus modification PilV family protein [Alteromonas]	Unknown	2.00
WP_014975392.1 pilus assembly PilX family protein [Alteromonas macleodii]	Unknown	2.00
WP_014975395.1 Maf family protein [Alteromonas macleodii]	Cytoplasmic	9.26
WP_014975432.1 MULTISPECIES: hybrid sensor histidine kinase/response regulator transcription factor [Alteromonas]	CytoplasmicMembrane	9.99
WP_014975438.1 MULTISPECIES: GMC oxidoreductase [Alteromonas]	CytoplasmicMembrane	7.88
WP_014975444.1 MULTISPECIES: 30S ribosomal protein S17 [Alteromonas]	Cytoplasmic	9.26
WP_014975448.1 MULTISPECIES: SdiA-regulated/phytase-like domain-containing protein [Alteromonas]	Unknown	4.90
WP_014975449.1 MULTISPECIES: methyl-accepting chemotaxis protein [Alteromonas]	Unknown	4.93
WP_014975450.1 MULTISPECIES: M3 family metallopeptidase [Alteromonas]	Unknown	6.49
WP_014975451.1 MULTISPECIES: hypothetical protein [Alteromonas]	Unknown	2.00
WP_014975452.1 MULTISPECIES: YgjV family protein [Alteromonas]	CytoplasmicMembrane	10.00
WP_014975453.1 MULTISPECIES: hypothetical protein [Alteromonas]	Unknown	2.00
WP_014975454.1 MULTISPECIES: formyltetrahydrofolate deformylase [Alteromonas]	Cytoplasmic	9.97
WP_014975455.1 MULTISPECIES: RNA 2',3'-cyclic phosphodiesterase [Alteromonas]	Unknown	2.00
WP_014975456.1 MULTISPECIES: ATP-dependent helicase HrpB [Alteromonas]	CytoplasmicMembrane	9.82
WP_014975457.1 MULTISPECIES: DUF4198 domain-containing protein [Alteromonas]	Unknown	2.50
WP_014975458.1 MULTISPECIES: lytic murein transglycosylase [Alteromonas]	CytoplasmicMembrane	9.97
WP_014975459.1 MULTISPECIES: penicillin-binding protein 1B [Alteromonas]	CytoplasmicMembrane	9.99
WP_014975460.1 MULTISPECIES: hypothetical protein [Alteromonas]	Unknown	2.50
WP_014975461.1 MULTISPECIES: DUF808 domain-containing protein [Alteromonas]	CytoplasmicMembrane	10.00
WP_014975463.1 MULTISPECIES: AraC family transcriptional regulator [Alteromonas]	Cytoplasmic	8.96
WP_014975467.1 MULTISPECIES: TetR/AcrR family transcriptional regulator [Alteromonas]	Cytoplasmic	9.26
WP_014975472.1 MULTISPECIES: putative bifunctional diguanylate cyclase/phosphodiesterase [Alteromonas]	CytoplasmicMembrane	7.88
WP_014975473.1 MULTISPECIES: succinylglutamate-semialdehyde dehydrogenase [Alteromonas]	Cytoplasmic	9.26
WP_014975481.1 MULTISPECIES: hypothetical protein [Alteromonas]	Unknown	2.50
WP_014975482.1 MULTISPECIES: glutathione-dependent disulfide-bond oxidoreductase [Alteromonas]	Cytoplasmic	9.26
WP_014975499.1 MULTISPECIES: tRNA (uridine(34)/cytosine(34)/5-carboxymethylaminomethyluridine(34)-2'-O)-methyltransferase TrmL [Alteromonas]	Unknown	2.00
WP_014975504.1 MULTISPECIES: NAD(P)H-dependent glycerol-3-phosphate dehydrogenase [Alteromonas]	Cytoplasmic	9.97
WP_014975509.1 MULTISPECIES: small ribosomal subunit biogenesis GTPase RsgA [Alteromonas]	Cytoplasmic	9.97
WP_014975511.1 MULTISPECIES: hotdog fold domain-containing protein [Alteromonas]	Unknown	2.00
WP_014975512.1 MULTISPECIES: acetolactate synthase 3 large subunit [Alteromonas]	Cytoplasmic	9.97
WP_014975513.1 MULTISPECIES: acetolactate synthase small subunit [Alteromonas]	Cytoplasmic	9.97
WP_014975545.1 MULTISPECIES: substrate-binding periplasmic protein [Alteromonas]	Unknown	2.50
WP_014975558.1 MULTISPECIES: hypothetical protein [Alteromonas]	Unknown	2.00
WP_014975559.1 MULTISPECIES: hypothetical protein [Alteromonas]	CytoplasmicMembrane	9.82
WP_014975597.1 MULTISPECIES: tRNA pseudouridine(13) synthase TruD [Alteromonas]	Cytoplasmic	8.96
WP_014975612.1 MULTISPECIES: sulfite exporter TauE/SafE family protein [Alteromonas]	CytoplasmicMembrane	10.00
WP_014975631.1 MULTISPECIES: DUF1249 domain-containing protein [Alteromonas]	Cytoplasmic	8.96
WP_014975634.1 MULTISPECIES: DNA topoisomerase IV subunit B [Alteromonas]	Cytoplasmic	9.97
WP_014975647.1 MULTISPECIES: elongation factor P [Alteromonas]	Cytoplasmic	9.97
WP_014975652.1 MULTISPECIES: peptidylprolyl isomerase [Alteromonas]	Periplasmic	9.76
WP_014975656.1 MULTISPECIES: phosphatase PAP2 family protein [Alteromonas]	CytoplasmicMembrane	10.00
WP_014975658.1 MULTISPECIES: nitrate regulatory protein [Alteromonas]	Cytoplasmic	8.96
WP_014975661.1 MULTISPECIES: nitrite reductase small subunit NirD [Alteromonas]	Cytoplasmic	9.26
WP_014975666.1 MULTISPECIES: ABC transporter ATP-binding protein [Alteromonas]	CytoplasmicMembrane	7.88
WP_014975670.1 MULTISPECIES: serine/threonine protein kinase [Alteromonas]	Cytoplasmic	9.97
WP_014975676.1 MULTISPECIES: mandelate racemase/muconate lactonizing enzyme family protein [Alteromonas]	Cytoplasmic	8.96
WP_014975690.1 MULTISPECIES: alpha/beta hydrolase-fold protein [Alteromonas]	Unknown	2.50
WP_014975692.1 MULTISPECIES: SOUL family heme-binding protein [Alteromonas]	Unknown	2.00
WP_014975697.1 MULTISPECIES: site-specific tyrosine recombinase XerD [Alteromonas]	Cytoplasmic	9.97
WP_014975700.1 MULTISPECIES: hypothetical protein [Alteromonas]	Cytoplasmic	8.96
WP_014975702.1 MULTISPECIES: pyridoxine 5'-phosphate synthase [Alteromonas]	Cytoplasmic	9.97
WP_014975711.1 MULTISPECIES: SDR family oxidoreductase [Alteromonas]	Cytoplasmic	9.97
WP_014975712.1 MULTISPECIES: TenA family transcriptional regulator [Alteromonas]	Cytoplasmic	8.96
WP_014975715.1 MULTISPECIES: TVP38/TMEM64 family protein [Alteromonas]	CytoplasmicMembrane	10.00
WP_014975716.1 MULTISPECIES: glycosyltransferase family 2 protein [Alteromonas]	CytoplasmicMembrane	9.82
WP_014975717.1 MULTISPECIES: hypothetical protein [Alteromonas]	Unknown	2.50
WP_014975719.1 MULTISPECIES: cupredoxin domain-containing protein [Alteromonas]	Unknown	2.50
WP_014975721.1 MULTISPECIES: response regulator [Alteromonas]	Cytoplasmic	9.97
WP_014975722.1 MULTISPECIES: hypothetical protein [Alteromonas]	Unknown	4.90
WP_014975723.1 MULTISPECIES: 30S ribosomal protein S9 [Alteromonas]	Cytoplasmic	9.97
WP_014975735.1 transglutaminase family protein [Alteromonas macleodii]	Cytoplasmic	9.97
WP_014975736.1 MULTISPECIES: potassium/proton antiporter [Alteromonas]	CytoplasmicMembrane	10.00
WP_014975742.1 MULTISPECIES: phosphoglycerate kinase [Alteromonas]	Cytoplasmic	9.97
WP_014975760.1 MULTISPECIES: universal stress protein [Alteromonas]	Cytoplasmic	9.97
WP_014975770.1 MULTISPECIES: redoxin domain-containing protein [Alteromonas]	Cytoplasmic	8.96
WP_014975806.1 MULTISPECIES: hypothetical protein [Alteromonas]	Unknown	2.00
WP_014975807.1 MULTISPECIES: CidA/LrgA family protein [Alteromonas]	CytoplasmicMembrane	10.00
WP_014975808.1 MULTISPECIES: LrgB family protein [Alteromonas]	CytoplasmicMembrane	10.00
WP_014975809.1 MULTISPECIES: response regulator [Alteromonas]	Cytoplasmic	9.97
WP_014975812.1 MULTISPECIES: YggN family protein [Alteromonas]	Unknown	4.90
WP_014975823.1 MULTISPECIES: phosphopyruvate hydratase [Alteromonas]	Cytoplasmic	9.97
WP_014975830.1 MULTISPECIES: heme exporter protein CcmD [Alteromonas]	Unknown	2.00
WP_014975838.1 MULTISPECIES: DUF6170 family protein [Alteromonas]	CytoplasmicMembrane	9.82
WP_014975841.1 MULTISPECIES: glycosyltransferase [Alteromonas]	Cytoplasmic	8.96
WP_014975843.1 MULTISPECIES: UTP--glucose-1-phosphate uridylyltransferase GalU [Alteromonas]	Cytoplasmic	9.97
WP_014975848.1 MULTISPECIES: 2,3,4,5-tetrahydropyridine-2,6-dicarboxylate N-succinyltransferase [Alteromonas]	Cytoplasmic	9.97
WP_014975850.1 MULTISPECIES: translation elongation factor Ts [Alteromonas]	Cytoplasmic	9.97
WP_014975863.1 MULTISPECIES: DNA endonuclease SmrA [Alteromonas]	Cytoplasmic	9.97
WP_014975874.1 MULTISPECIES: CheR family methyltransferase [Alteromonas]	Cytoplasmic	9.26
WP_014975903.1 MULTISPECIES: flagellar motor switch protein FliG [Alteromonas]	Cytoplasmic	9.12
WP_014975907.1 MULTISPECIES: flagellar biosynthetic protein FliO [Alteromonas]	CytoplasmicMembrane	10.00
WP_014975911.1 MULTISPECIES: L,D-transpeptidase family protein [Alteromonas]	Unknown	2.50
WP_014975920.1 alanine--tRNA ligase [Alteromonas macleodii]	Cytoplasmic	9.97
WP_014975921.1 acyl-CoA thioesterase [Alteromonas macleodii]	Unknown	2.00
WP_014975922.1 MULTISPECIES: OadG family protein [Alteromonas]	CytoplasmicMembrane	9.82
WP_014975930.1 MULTISPECIES: maleylacetoacetate isomerase [Alteromonas]	Cytoplasmic	9.97
WP_014975961.1 MULTISPECIES: response regulator transcription factor [Alteromonas]	Cytoplasmic	9.26
WP_014975964.1 MULTISPECIES: endonuclease/exonuclease/phosphatase family protein [Alteromonas]	Unknown	4.90
WP_014975982.1 MULTISPECIES: PrkA family serine protein kinase [Alteromonas]	Cytoplasmic	8.96
WP_014975986.1 MULTISPECIES: flagellar protein MotY [Alteromonas]	OuterMembrane	9.93
WP_014975990.1 MULTISPECIES: endonuclease III domain-containing protein [Alteromonas]	Cytoplasmic	9.97
WP_014975992.1 MULTISPECIES: electron transport complex subunit RsxB [Alteromonas]	Cytoplasmic	9.97
WP_014975993.1 MULTISPECIES: electron transport complex subunit RsxA [Alteromonas]	CytoplasmicMembrane	10.00
WP_014975995.1 MULTISPECIES: 7-cyano-7-deazaguanine synthase QueC [Alteromonas]	Unknown	2.00
WP_014975996.1 MULTISPECIES: type 2 periplasmic-binding domain-containing protein [Alteromonas]	Unknown	4.90
WP_014976004.1 MULTISPECIES: sigma-70 family RNA polymerase sigma factor [Alteromonas]	CytoplasmicMembrane	7.88
WP_014976006.1 vWA domain-containing protein [Alteromonas macleodii]	CytoplasmicMembrane	10.00
WP_014976007.1 vWA domain-containing protein [Alteromonas macleodii]	CytoplasmicMembrane	10.00
WP_014976008.1 DUF4381 domain-containing protein [Alteromonas macleodii]	Unknown	2.00
WP_014976009.1 DUF58 domain-containing protein [Alteromonas macleodii]	Cytoplasmic	9.26
WP_014976012.1 MULTISPECIES: phosphohistidine phosphatase SixA [Alteromonas]	Unknown	2.00
WP_014976023.1 MULTISPECIES: bifunctional chorismate mutase/prephenate dehydrogenase [Alteromonas]	Cytoplasmic	9.97
WP_014976026.1 MULTISPECIES: GGDEF domain-containing protein [Alteromonas]	CytoplasmicMembrane	9.97
WP_014976030.1 MULTISPECIES: fused response regulator/phosphatase [Alteromonas]	Cytoplasmic	9.97
WP_014976038.1 MULTISPECIES: hypothetical protein [Alteromonas]	Unknown	2.00
WP_014976045.1 MULTISPECIES: M48 metallopeptidase family protein [Alteromonas]	Cytoplasmic	9.26
WP_014976048.1 MULTISPECIES: TetR/AcrR family transcriptional regulator [Alteromonas]	Cytoplasmic	9.97
WP_014976079.1 MULTISPECIES: arylesterase [Alteromonas]	Periplasmic	9.76
WP_014976085.1 MULTISPECIES: ATP-binding protein [Alteromonas]	CytoplasmicMembrane	10.00
WP_014976090.1 MULTISPECIES: tryptophan synthase subunit beta [Alteromonas]	Cytoplasmic	9.97
WP_014976104.1 MULTISPECIES: DNA starvation/stationary phase protection protein Dps [Alteromonas]	Cytoplasmic	9.97
WP_014976110.1 MULTISPECIES: GntP family permease [Alteromonas]	CytoplasmicMembrane	10.00
WP_014976121.1 MULTISPECIES: 4-hydroxy-tetrahydrodipicolinate reductase [Alteromonas]	Cytoplasmic	9.97
WP_014976126.1 MULTISPECIES: NUDIX domain-containing protein [Alteromonas]	Cytoplasmic	8.96
WP_014976127.1 MULTISPECIES: DUF3224 domain-containing protein [Alteromonas]	Unknown	2.00
WP_014976128.1 MULTISPECIES: Hsp20 family protein [Alteromonas]	Cytoplasmic	9.97
WP_014976150.1 MULTISPECIES: 50S ribosomal protein L25/general stress protein Ctc [Alteromonas]	Cytoplasmic	9.97
WP_014976158.1 MULTISPECIES: alpha/beta family hydrolase [Alteromonas]	Cytoplasmic	8.96
WP_014976177.1 MULTISPECIES: MarR family winged helix-turn-helix transcriptional regulator [Alteromonas]	Unknown	2.00
WP_014976187.1 MULTISPECIES: (2Fe-2S)-binding protein [Alteromonas]	Cytoplasmic	9.26
WP_014976188.1 MULTISPECIES: putative quinol monooxygenase [Alteromonas]	Unknown	2.00
WP_014976191.1 MULTISPECIES: guanine deaminase [Alteromonas]	Cytoplasmic	9.26
WP_014976193.1 xanthine dehydrogenase accessory protein XdhC [Alteromonas macleodii]	Cytoplasmic	8.96
WP_014976199.1 MULTISPECIES: adenosine deaminase [Alteromonas]	Cytoplasmic	9.97
WP_014976207.1 MULTISPECIES: AraC family ligand binding domain-containing protein [Alteromonas]	Cytoplasmic	8.96
WP_014976220.1 MULTISPECIES: threonine--tRNA ligase [Alteromonas]	Cytoplasmic	10.00
WP_014976221.1 MULTISPECIES: mannose-1-phosphate guanylyltransferase/mannose-6-phosphate isomerase [Alteromonas]	Cytoplasmic	8.96
WP_014976255.1 MULTISPECIES: PilZ domain-containing protein [Alteromonas]	Cytoplasmic	8.96
WP_014976262.1 MULTISPECIES: HDOD domain-containing protein [Alteromonas]	Unknown	2.00
WP_014976265.1 MULTISPECIES: alpha/beta fold hydrolase [Alteromonas]	Cytoplasmic	9.26
WP_014976266.1 MULTISPECIES: glucose-1-phosphate adenylyltransferase [Alteromonas]	Cytoplasmic	8.96
WP_014976267.1 MULTISPECIES: SRPBCC family protein [Gammaproteobacteria]	CytoplasmicMembrane	9.82
WP_014976276.1 MULTISPECIES: FapA family protein [Alteromonas]	Cytoplasmic	8.96
WP_014976293.1 MULTISPECIES: DUF2061 domain-containing protein [Alteromonas]	Unknown	2.00
WP_014976297.1 MULTISPECIES: DNA polymerase III subunit epsilon [Alteromonas]	Cytoplasmic	9.97
WP_014976306.1 MULTISPECIES: DUF2058 domain-containing protein [Alteromonas]	Cytoplasmic	9.26
WP_014976308.1 MULTISPECIES: LysR family transcriptional regulator [Alteromonas]	Cytoplasmic	9.97
WP_014976317.1 MULTISPECIES: haloacid dehalogenase type II [Alteromonas]	Unknown	2.50
WP_014976321.1 MULTISPECIES: 23S rRNA pseudouridine(955/2504/2580) synthase RluC [Alteromonas]	Cytoplasmic	9.97
WP_014976322.1 MULTISPECIES: HAD-IA family hydrolase [Alteromonas]	Cytoplasmic	9.97
WP_014976324.1 MULTISPECIES: 23S rRNA accumulation protein YceD [Alteromonas]	Cytoplasmic	8.96
WP_014976325.1 MULTISPECIES: phosphate acyltransferase PlsX [Alteromonas]	Cytoplasmic	9.26
WP_014976326.1 MULTISPECIES: 3-oxoacyl-ACP reductase FabG [Alteromonas]	Cytoplasmic	9.26
WP_014976329.1 MULTISPECIES: M2 family metallopeptidase [Alteromonas]	Unknown	4.90
WP_014976337.1 MULTISPECIES: HAD family hydrolase [Alteromonas]	Cytoplasmic	9.26
WP_014976346.1 MULTISPECIES: mechanosensitive ion channel family protein [Alteromonas]	CytoplasmicMembrane	10.00
WP_014976347.1 MULTISPECIES: TonB-dependent receptor [Alteromonas]	OuterMembrane	10.00
WP_014976348.1 MULTISPECIES: MHYT domain-containing protein [Alteromonas]	CytoplasmicMembrane	10.00
WP_014976349.1 MULTISPECIES: response regulator [Alteromonas]	Cytoplasmic	9.97
WP_014976359.1 MULTISPECIES: alkyl hydroperoxide reductase subunit F [Alteromonas]	CytoplasmicMembrane	7.88
WP_014976383.1 MULTISPECIES: NADH:flavin oxidoreductase/NADH oxidase family protein [Alteromonas]	Periplasmic	9.80
WP_014976399.1 MULTISPECIES: rRNA large subunit pseudouridine synthase E [Alteromonas]	Cytoplasmic	9.26
WP_014976409.1 MULTISPECIES: lipoyl(octanoyl) transferase LipB [Alteromonas]	Cytoplasmic	9.97
WP_014976410.1 MULTISPECIES: septal ring lytic transglycosylase RlpA family protein [Alteromonas]	Unknown	2.00
WP_014976475.1 MULTISPECIES: hypothetical protein [Alteromonas]	CytoplasmicMembrane	9.82
WP_014976507.1 MULTISPECIES: MAPEG family protein [Alteromonas]	CytoplasmicMembrane	10.00
WP_014976508.1 MULTISPECIES: hypothetical protein [Alteromonas]	CytoplasmicMembrane	9.82
WP_014976509.1 MULTISPECIES: hypothetical protein [Alteromonas]	CytoplasmicMembrane	9.82
WP_014976510.1 MULTISPECIES: hypothetical protein [Alteromonas]	Unknown	2.00
WP_014976528.1 MULTISPECIES: 3-deoxy-manno-octulosonate cytidylyltransferase [Alteromonas]	Cytoplasmic	9.97
WP_014976532.1 MULTISPECIES: DUF2919 family protein [Alteromonas]	CytoplasmicMembrane	10.00
WP_014976545.1 MULTISPECIES: MFS transporter [Alteromonas]	CytoplasmicMembrane	10.00
WP_014976569.1 MULTISPECIES: PaaI family thioesterase [Gammaproteobacteria]	Cytoplasmic	9.26
WP_014976574.1 hypothetical protein [Alteromonas macleodii]	Cytoplasmic	8.96
WP_014976575.1 MULTISPECIES: DEAD/DEAH box helicase [Alteromonas]	Cytoplasmic	9.97
