SeqID	Localization	Score
WP_156078008.1 flagellar hook-associated protein FlgL [Alteromonas macleodii]	Extracellular	10.00
WP_156078009.1 MULTISPECIES: flagellar filament capping protein FliD [Alteromonas]	Extracellular	9.96
WP_156078010.1 MULTISPECIES: hypothetical protein [Alteromonas]	Unknown	2.00
WP_156078011.1 MULTISPECIES: motility associated factor glycosyltransferase family protein [Alteromonas]	Unknown	2.00
WP_156078012.1 MULTISPECIES: glycosyltransferase [Alteromonas]	Cytoplasmic	8.96
WP_156078015.1 MULTISPECIES: Gfo/Idh/MocA family protein [Alteromonas]	Cytoplasmic	8.96
WP_156078016.1 MULTISPECIES: acylneuraminate cytidylyltransferase family protein [Alteromonas]	Cytoplasmic	9.97
WP_156078018.1 MULTISPECIES: FAD-dependent oxidoreductase [Alteromonas]	Cytoplasmic	8.96
WP_156078020.1 MULTISPECIES: GDP-L-fucose synthase family protein [Alteromonas]	Cytoplasmic	9.97
WP_156078021.1 MULTISPECIES: UDP-4-amino-4,6-dideoxy-N-acetyl-beta-L-altrosamine transaminase [Alteromonas]	Cytoplasmic	9.97
WP_156078022.1 MULTISPECIES: HAD family hydrolase [Alteromonas]	Cytoplasmic	8.96
WP_156078023.1 MULTISPECIES: ATP-grasp domain-containing protein [Alteromonas]	Cytoplasmic	8.96
WP_156078024.1 MULTISPECIES: LicD family protein [Alteromonas]	Unknown	2.00
WP_156078025.1 MULTISPECIES: pseudaminic acid synthase [Alteromonas]	Cytoplasmic	8.96
WP_156078026.1 MULTISPECIES: pseudaminic acid cytidylyltransferase [Alteromonas]	Cytoplasmic	9.26
WP_156078027.1 MULTISPECIES: flagellin [Alteromonas]	Unknown	5.02
WP_156078028.1 MULTISPECIES: sensor histidine kinase [Alteromonas]	CytoplasmicMembrane	9.82
WP_156078029.1 flagellar hook-basal body complex protein FliE [Alteromonas macleodii]	Periplasmic	9.44
WP_156078030.1 flagellar assembly protein FliH [Alteromonas macleodii]	Cytoplasmic	9.97
WP_156078031.1 flagellar hook-length control protein FliK [Alteromonas macleodii]	Extracellular	9.64
WP_156078032.1 flagellar biosynthetic protein FliR [Alteromonas macleodii]	CytoplasmicMembrane	10.00
WP_156078033.1 flagellar biosynthesis protein FlhB [Alteromonas macleodii]	CytoplasmicMembrane	10.00
WP_156078034.1 D-Ala-D-Ala carboxypeptidase family metallohydrolase [Alteromonas macleodii]	Unknown	2.00
WP_156078035.1 protein phosphatase CheZ [Alteromonas macleodii]	Cytoplasmic	9.97
WP_156078036.1 chemotaxis protein CheA [Alteromonas macleodii]	Cytoplasmic	9.97
WP_156078037.1 protein-glutamate methylesterase/protein-glutamine glutaminase [Alteromonas macleodii]	Cytoplasmic	9.97
WP_156078038.1 chemotaxis protein CheW [Alteromonas macleodii]	Unknown	2.00
WP_156078039.1 homoserine O-acetyltransferase MetA [Alteromonas macleodii]	Cytoplasmic	9.97
WP_156078040.1 MULTISPECIES: homocysteine S-methyltransferase family protein [Alteromonas]	Cytoplasmic	9.97
WP_156078041.1 methionine synthase [Alteromonas macleodii]	Cytoplasmic	9.97
WP_156078042.1 DUF938 domain-containing protein [Alteromonas macleodii]	Unknown	2.00
WP_156078043.1 methyl-accepting chemotaxis protein [Alteromonas macleodii]	CytoplasmicMembrane	9.99
WP_156078045.1 M13 family metallopeptidase [Alteromonas macleodii]	Unknown	4.99
WP_156078046.1 sodium-extruding oxaloacetate decarboxylase subunit alpha [Alteromonas macleodii]	Cytoplasmic	9.97
WP_156078047.1 phage shock protein operon transcriptional activator [Alteromonas macleodii]	Cytoplasmic	9.97
WP_156078048.1 Glu/Leu/Phe/Val dehydrogenase dimerization domain-containing protein [Alteromonas macleodii]	Cytoplasmic	9.97
WP_156078049.1 MULTISPECIES: late competence development ComFB family protein [Alteromonas]	Cytoplasmic	8.96
WP_156078050.1 tryptophan 2,3-dioxygenase family protein [Alteromonas macleodii]	Cytoplasmic	9.97
WP_156078051.1 MULTISPECIES: TonB-dependent receptor [Alteromonas]	OuterMembrane	10.00
WP_156078052.1 MULTISPECIES: prolyl hydroxylase family protein [Alteromonas]	Unknown	2.00
WP_156078053.1 MULTISPECIES: MotA/TolQ/ExbB proton channel family protein [Alteromonas]	CytoplasmicMembrane	10.00
WP_156078054.1 MULTISPECIES: tetratricopeptide repeat protein [Alteromonas]	Unknown	2.50
WP_156078055.1 MULTISPECIES: GNAT family N-acetyltransferase [Alteromonas]	CytoplasmicMembrane	9.82
WP_156078056.1 MULTISPECIES: TonB-dependent receptor [Alteromonas]	OuterMembrane	10.00
WP_156078057.1 ribosomal protein S18-alanine N-acetyltransferase [Alteromonas macleodii]	Cytoplasmic	9.26
WP_156078058.1 MULTISPECIES: MFS transporter [Alteromonas]	CytoplasmicMembrane	10.00
WP_156078059.1 TIGR03571 family LLM class oxidoreductase [Alteromonas macleodii]	Cytoplasmic	9.26
WP_156078060.1 2,5-didehydrogluconate reductase DkgB [Alteromonas macleodii]	Cytoplasmic	9.97
WP_156078061.1 alcohol dehydrogenase catalytic domain-containing protein [Alteromonas macleodii]	Cytoplasmic	8.96
WP_156078062.1 HlyD family secretion protein [Alteromonas macleodii]	CytoplasmicMembrane	7.88
WP_156078063.1 two-component system response regulator BtsR [Alteromonas macleodii]	Cytoplasmic	9.97
WP_156078064.1 MULTISPECIES: tetratricopeptide repeat-containing sulfotransferase family protein [Alteromonas]	Cytoplasmic	8.96
WP_156078065.1 pentapeptide repeat-containing protein [Alteromonas macleodii]	Extracellular	9.71
WP_156078066.1 MULTISPECIES: PLP-dependent cysteine synthase family protein [Alteromonas]	Cytoplasmic	9.26
WP_156078067.1 MULTISPECIES: DUF417 family protein [Alteromonas]	CytoplasmicMembrane	10.00
WP_156078068.1 MULTISPECIES: SDR family oxidoreductase [Alteromonas]	Unknown	2.00
WP_156078069.1 MULTISPECIES: fatty acid desaturase family protein [Alteromonas]	CytoplasmicMembrane	9.16
WP_156078070.1 MULTISPECIES: hypothetical protein [Alteromonas]	CytoplasmicMembrane	9.82
WP_156078071.1 MULTISPECIES: peptide chain release factor 2 [Alteromonas]	Cytoplasmic	9.97
WP_156078072.1 MULTISPECIES: ketopantoate reductase family protein [Alteromonas]	Unknown	2.00
WP_156078073.1 M16 family metallopeptidase [Alteromonas macleodii]	Unknown	2.00
WP_156078074.1 MULTISPECIES: glutamate--cysteine ligase [Alteromonas]	Cytoplasmic	9.97
WP_156078075.1 MULTISPECIES: hypothetical protein [Alteromonas]	Unknown	2.00
WP_156078076.1 MULTISPECIES: chorismate synthase [Alteromonas]	Cytoplasmic	9.97
WP_156078077.1 MULTISPECIES: MFS transporter [Alteromonas]	CytoplasmicMembrane	10.00
WP_156078078.1 MULTISPECIES: TonB-dependent receptor plug domain-containing protein [Alteromonas]	OuterMembrane	8.53
WP_156078079.1 MULTISPECIES: FecR family protein [Alteromonas]	CytoplasmicMembrane	9.82
WP_156078080.1 MULTISPECIES: ribonuclease T [Alteromonas]	Cytoplasmic	9.26
WP_156078081.1 MULTISPECIES: glycerophosphodiester phosphodiesterase [Alteromonas]	Periplasmic	9.76
WP_156078082.1 MULTISPECIES: M20/M25/M40 family metallo-hydrolase [Alteromonas]	Extracellular	9.78
WP_156078083.1 MULTISPECIES: electron transport complex subunit E [Alteromonas]	CytoplasmicMembrane	10.00
WP_156078084.1 MULTISPECIES: 3'(2'),5'-bisphosphate nucleotidase CysQ [Alteromonas]	Cytoplasmic	9.26
WP_156078085.1 MULTISPECIES: DUF885 domain-containing protein [Alteromonas]	Unknown	4.90
WP_156078086.1 BatD family protein [Alteromonas macleodii]	CytoplasmicMembrane	9.86
WP_156078087.1 acetyl-CoA C-acyltransferase FadI [Alteromonas macleodii]	Cytoplasmic	9.26
WP_156078088.1 MULTISPECIES: fatty acid oxidation complex subunit alpha FadJ [Alteromonas]	Cytoplasmic	9.97
WP_156078089.1 MULTISPECIES: EAL domain-containing protein [Alteromonas]	Unknown	4.86
WP_156078090.1 MULTISPECIES: insulinase family protein [Alteromonas]	Unknown	5.41
WP_156078091.1 MULTISPECIES: YncE family protein [Alteromonas]	CytoplasmicMembrane	9.86
WP_156078092.1 ATP-binding protein [Alteromonas macleodii]	Cytoplasmic	8.96
WP_156078093.1 MULTISPECIES: phosphoenolpyruvate carboxylase [Alteromonas]	Cytoplasmic	8.96
WP_156078094.1 MULTISPECIES: TerB family tellurite resistance protein [Alteromonas]	Cytoplasmic	8.96
WP_156078095.1 MULTISPECIES: efflux RND transporter periplasmic adaptor subunit [Alteromonas]	CytoplasmicMembrane	9.99
WP_156078096.1 MULTISPECIES: ABC transporter transmembrane domain-containing protein [Alteromonas]	CytoplasmicMembrane	10.00
WP_156078097.1 MULTISPECIES: DsbA family protein [Alteromonas]	Cytoplasmic	8.96
WP_156078098.1 MULTISPECIES: tRNA (guanosine(37)-N1)-methyltransferase TrmD [Alteromonas]	Cytoplasmic	9.97
WP_156078099.1 MULTISPECIES: enoyl-CoA hydratase/isomerase family protein [Alteromonas]	Cytoplasmic	8.96
WP_156078100.1 MULTISPECIES: pepsin-like aspartic protease [Alteromonas]	Cytoplasmic	8.96
WP_156078101.1 MULTISPECIES: SAM-dependent methyltransferase [Alteromonas]	Unknown	2.00
WP_156078102.1 MULTISPECIES: tellurite resistance TerB family protein [Alteromonas]	Unknown	4.90
WP_156078103.1 MULTISPECIES: putative bifunctional diguanylate cyclase/phosphodiesterase [Alteromonas]	CytoplasmicMembrane	9.82
WP_156078104.1 MULTISPECIES: hypothetical protein [Alteromonas]	Cytoplasmic	8.96
WP_156078105.1 MULTISPECIES: GAF domain-containing protein [Alteromonas]	Unknown	2.00
WP_156078106.1 MULTISPECIES: Holliday junction branch migration DNA helicase RuvB [Alteromonas]	Cytoplasmic	9.97
WP_156078107.1 MULTISPECIES: protein TolR [Alteromonas]	CytoplasmicMembrane	9.82
WP_156078108.1 MULTISPECIES: cell envelope integrity protein TolA [Alteromonas]	Unknown	2.00
WP_156078109.1 MULTISPECIES: Tol-Pal system beta propeller repeat protein TolB [Alteromonas]	Periplasmic	9.76
WP_156078111.1 MULTISPECIES: hypothetical protein [Alteromonas]	Cytoplasmic	8.96
WP_156078112.1 MULTISPECIES: BRCT domain-containing protein [Alteromonas]	Cytoplasmic	8.96
WP_156078113.1 MULTISPECIES: recombinase family protein [Alteromonas]	Cytoplasmic	8.96
WP_156078115.1 MULTISPECIES: hypothetical protein [Alteromonas]	Unknown	2.00
WP_156078116.1 2-dehydropantoate 2-reductase [Alteromonas macleodii]	Unknown	2.50
WP_156078117.1 MULTISPECIES: hypothetical protein [Alteromonas]	OuterMembrane	9.52
WP_156078118.1 MULTISPECIES: efflux RND transporter permease subunit [Alteromonas]	CytoplasmicMembrane	10.00
WP_156078119.1 MULTISPECIES: TonB-dependent receptor [Alteromonas]	OuterMembrane	10.00
WP_156078120.1 MULTISPECIES: GNAT family N-acetyltransferase [Alteromonas]	Cytoplasmic	9.26
WP_156078121.1 MULTISPECIES: efflux RND transporter permease subunit [Alteromonas]	CytoplasmicMembrane	10.00
WP_156078122.1 efflux RND transporter periplasmic adaptor subunit [Alteromonas macleodii]	Cytoplasmic	8.96
WP_156078123.1 MULTISPECIES: GGDEF domain-containing protein [Alteromonas]	CytoplasmicMembrane	10.00
WP_156078124.1 MULTISPECIES: PqiC family protein [Alteromonas]	Unknown	2.00
WP_156078125.1 intermembrane transport protein PqiB [Alteromonas macleodii]	Cytoplasmic	8.96
WP_156078126.1 paraquat-inducible protein A [Alteromonas macleodii]	CytoplasmicMembrane	10.00
WP_156078127.1 MULTISPECIES: hypothetical protein [Alteromonas]	CytoplasmicMembrane	10.00
WP_156078128.1 MULTISPECIES: asparagine--tRNA ligase [Alteromonas]	Cytoplasmic	10.00
WP_156078129.1 hypothetical protein [Alteromonas macleodii]	CytoplasmicMembrane	10.00
WP_156078130.1 RimK family protein [Alteromonas macleodii]	Cytoplasmic	9.97
WP_156078131.1 MULTISPECIES: GNAT family N-acetyltransferase/peptidase C39 family protein [Alteromonas]	Cytoplasmic	9.97
WP_156078133.1 MULTISPECIES: adenosylmethionine--8-amino-7-oxononanoate transaminase [Alteromonas]	Cytoplasmic	9.97
WP_156078134.1 MULTISPECIES: biotin synthase BioB [Alteromonas]	Cytoplasmic	9.97
WP_156078135.1 MULTISPECIES: aminotransferase class I/II-fold pyridoxal phosphate-dependent enzyme [Alteromonas]	Cytoplasmic	9.26
WP_156078136.1 methyltransferase domain-containing protein [Alteromonas macleodii]	Unknown	2.00
WP_156078137.1 MULTISPECIES: dethiobiotin synthase [Alteromonas]	Cytoplasmic	9.97
WP_156078138.1 ABC transporter ATP-binding protein [Alteromonas macleodii]	Unknown	6.29
WP_156078139.1 MULTISPECIES: sensor histidine kinase [Alteromonas]	CytoplasmicMembrane	10.00
WP_156078140.1 MULTISPECIES: TrkH family potassium uptake protein [Alteromonas]	CytoplasmicMembrane	10.00
WP_156078141.1 MULTISPECIES: hypothetical protein [Alteromonas]	Unknown	2.00
WP_156078142.1 MULTISPECIES: GTP 3',8-cyclase MoaA [Alteromonas]	Cytoplasmic	9.97
WP_156078143.1 MULTISPECIES: GNAT family N-acetyltransferase [Alteromonas]	Unknown	2.00
WP_156078144.1 MULTISPECIES: M14 family metallopeptidase [Alteromonas]	Cytoplasmic	8.96
WP_156078145.1 MULTISPECIES: tRNA-dihydrouridine synthase [Alteromonas]	Cytoplasmic	9.97
WP_156078146.1 MULTISPECIES: transposase [Alteromonas]	Cytoplasmic	8.96
WP_156078147.1 MULTISPECIES: ABC transporter permease [Alteromonas]	CytoplasmicMembrane	10.00
WP_156078148.1 MULTISPECIES: TIGR01777 family oxidoreductase [Alteromonas]	Cytoplasmic	9.26
WP_156078149.1 MULTISPECIES: tryptophan synthase subunit alpha [Alteromonas]	Cytoplasmic	9.97
WP_156078150.1 MULTISPECIES: bifunctional indole-3-glycerol-phosphate synthase TrpC/phosphoribosylanthranilate isomerase TrpF [Alteromonas]	Cytoplasmic	9.97
WP_156078151.1 MULTISPECIES: DUF4097 family beta strand repeat-containing protein [Alteromonas]	Unknown	2.50
WP_156078152.1 MULTISPECIES: DUF445 domain-containing protein [Alteromonas]	CytoplasmicMembrane	10.00
WP_156078153.1 MULTISPECIES: thiopurine S-methyltransferase [Alteromonas]	Cytoplasmic	9.26
WP_156078154.1 MULTISPECIES: DNA repair protein RecN [Alteromonas]	Cytoplasmic	9.97
WP_156078155.1 iron-containing alcohol dehydrogenase [Alteromonas macleodii]	Cytoplasmic	9.26
WP_156078156.1 MULTISPECIES: 3-hydroxybutyrate dehydrogenase [Alteromonas]	Cytoplasmic	9.97
WP_156078157.1 extracellular catalytic domain type 2 short-chain-length polyhydroxyalkanoate depolymerase [Alteromonas macleodii]	Unknown	2.50
WP_156078158.1 MULTISPECIES: E22 family MetX-like putative esterase [Alteromonas]	Unknown	3.91
WP_156078159.1 MULTISPECIES: TonB-dependent receptor [Alteromonas]	OuterMembrane	10.00
WP_156078160.1 pepsin/retropepsin-like aspartic protease family protein [Alteromonas macleodii]	Unknown	2.50
WP_156078161.1 hybrid sensor histidine kinase/response regulator [Alteromonas macleodii]	CytoplasmicMembrane	10.00
WP_156078162.1 MULTISPECIES: tetratricopeptide repeat protein [Alteromonas]	Unknown	2.00
WP_156078163.1 MULTISPECIES: bifunctional diguanylate cyclase/phosphodiesterase [Alteromonas]	CytoplasmicMembrane	7.88
WP_156078164.1 methyl-accepting chemotaxis protein [Alteromonas macleodii]	OuterMembrane	9.92
WP_156078165.1 MULTISPECIES: phosphate acetyltransferase [Alteromonas]	Cytoplasmic	9.97
WP_156078166.1 MULTISPECIES: Xaa-Pro dipeptidase [Alteromonas]	Unknown	4.90
WP_156078167.1 MULTISPECIES: apolipoprotein N-acyltransferase [Alteromonas]	CytoplasmicMembrane	10.00
WP_156078168.1 MULTISPECIES: rRNA maturation RNase YbeY [Alteromonas]	Cytoplasmic	9.97
WP_156078169.1 tRNA (N6-isopentenyl adenosine(37)-C2)-methylthiotransferase MiaB [Alteromonas macleodii]	Cytoplasmic	9.97
WP_156078170.1 MULTISPECIES: FAD-dependent monooxygenase [Alteromonas]	Cytoplasmic	9.26
WP_156078171.1 MULTISPECIES: TetR/AcrR family transcriptional regulator [Alteromonas]	Cytoplasmic	9.97
WP_156078172.1 MULTISPECIES: flavin reductase family protein [Alteromonas]	Unknown	2.00
WP_156078173.1 MULTISPECIES: alanine/glycine:cation symporter family protein [Alteromonas]	CytoplasmicMembrane	10.00
WP_156078174.1 peptidylprolyl isomerase [Alteromonas macleodii]	Periplasmic	9.76
WP_156078175.1 MULTISPECIES: redox-regulated ATPase YchF [Alteromonas]	Cytoplasmic	8.96
WP_156078176.1 MULTISPECIES: NADPH-dependent aldehyde reductase Ahr [Alteromonas]	Cytoplasmic	9.97
WP_156078177.1 peptide chain release factor N(5)-glutamine methyltransferase [Alteromonas macleodii]	Cytoplasmic	9.26
WP_156078178.1 MULTISPECIES: protein kinase domain-containing protein [Alteromonas]	Cytoplasmic	9.26
WP_156078179.1 DUF58 domain-containing protein [Alteromonas macleodii]	Unknown	4.65
WP_156078180.1 MULTISPECIES: succinylglutamate desuccinylase [Alteromonas]	Cytoplasmic	9.97
WP_156078181.1 dicarboxylate/amino acid:cation symporter [Alteromonas macleodii]	CytoplasmicMembrane	10.00
WP_156078182.1 MULTISPECIES: M15 family metallopeptidase [Alteromonas]	Unknown	2.00
WP_156078183.1 succinyl-diaminopimelate desuccinylase [Alteromonas macleodii]	Cytoplasmic	9.97
WP_156078184.1 MULTISPECIES: sensor domain-containing protein [Alteromonas]	CytoplasmicMembrane	7.88
WP_156078185.1 MULTISPECIES: EAL domain-containing protein [Alteromonas]	CytoplasmicMembrane	9.82
WP_156078186.1 MBL fold metallo-hydrolase [Alteromonas macleodii]	Unknown	2.50
WP_156078187.1 MULTISPECIES: efflux RND transporter permease subunit [Alteromonas]	CytoplasmicMembrane	10.00
WP_156078188.1 MULTISPECIES: efflux RND transporter periplasmic adaptor subunit [Alteromonas]	CytoplasmicMembrane	9.97
WP_156078189.1 monovalent cation:proton antiporter-2 (CPA2) family protein [Alteromonas macleodii]	CytoplasmicMembrane	10.00
WP_156078190.1 MULTISPECIES: NAD(P)H-dependent oxidoreductase [Alteromonas]	Cytoplasmic	9.97
WP_156078191.1 hypothetical protein [Alteromonas macleodii]	Periplasmic	9.83
WP_156078192.1 MULTISPECIES: xanthine dehydrogenase family protein molybdopterin-binding subunit [Alteromonas]	CytoplasmicMembrane	9.97
WP_156078193.1 MULTISPECIES: diguanylate cyclase [Alteromonas]	Cytoplasmic	9.97
WP_156078194.1 MULTISPECIES: urate hydroxylase PuuD [Alteromonas]	CytoplasmicMembrane	10.00
WP_156078195.1 hydroxyisourate hydrolase [Alteromonas macleodii]	Unknown	2.00
WP_156078196.1 MULTISPECIES: xanthine dehydrogenase molybdopterin binding subunit [Alteromonas]	Cytoplasmic	8.96
WP_156078197.1 xanthine dehydrogenase small subunit [Alteromonas macleodii]	Cytoplasmic	9.26
WP_156078198.1 MULTISPECIES: Hpt domain-containing protein [Alteromonas]	Unknown	2.00
WP_156078199.1 MULTISPECIES: hybrid sensor histidine kinase/response regulator [Alteromonas]	CytoplasmicMembrane	7.88
WP_156078200.1 MULTISPECIES: purine nucleoside permease [Alteromonas]	Unknown	2.50
WP_156078201.1 MULTISPECIES: TonB-dependent siderophore receptor [Alteromonas]	OuterMembrane	9.52
WP_156078202.1 uracil-xanthine permease family protein [Alteromonas macleodii]	CytoplasmicMembrane	10.00
WP_156078203.1 MULTISPECIES: adenosine deaminase family protein [Alteromonas]	Unknown	2.00
WP_156078204.1 MULTISPECIES: allantoate amidohydrolase [Alteromonas]	Cytoplasmic	8.96
WP_156078205.1 MULTISPECIES: pyridoxal-phosphate-dependent aminotransferase family protein [Alteromonas]	Cytoplasmic	9.97
WP_156078206.1 MULTISPECIES: gamma-glutamyltransferase family protein [Alteromonas]	Periplasmic	9.44
WP_156078207.1 amidase [Alteromonas macleodii]	CytoplasmicMembrane	8.46
WP_156078208.1 MULTISPECIES: mechanosensitive ion channel family protein [Alteromonas]	CytoplasmicMembrane	10.00
WP_156078209.1 DUF3080 family protein [Alteromonas macleodii]	Unknown	2.00
WP_156078210.1 MULTISPECIES: pteridine reductase [Alteromonas]	Cytoplasmic	9.26
WP_156078211.1 MULTISPECIES: fructosamine kinase family protein [Alteromonas]	Unknown	2.00
WP_156078212.1 MULTISPECIES: outer membrane beta-barrel protein [Alteromonas]	OuterMembrane	9.52
WP_156078214.1 MULTISPECIES: GumC family protein [Alteromonas]	CytoplasmicMembrane	7.88
WP_156078215.1 MULTISPECIES: VpsP family polysaccharide biosynthesis protein [Alteromonas]	Unknown	2.00
WP_156078216.1 MULTISPECIES: 3-phosphoshikimate 1-carboxyvinyltransferase [Alteromonas]	CytoplasmicMembrane	9.82
WP_156078217.1 MULTISPECIES: O-antigen ligase family protein [Alteromonas]	CytoplasmicMembrane	10.00
WP_156078218.1 MULTISPECIES: bifunctional diguanylate cyclase/phosphodiesterase [Alteromonas]	CytoplasmicMembrane	10.00
WP_156078219.1 MULTISPECIES: glycosyltransferase [Alteromonas]	Cytoplasmic	9.97
WP_156078220.1 MULTISPECIES: O-antigen ligase family protein [Alteromonas]	CytoplasmicMembrane	10.00
WP_156078221.1 MULTISPECIES: glycosyltransferase family 4 protein [Alteromonas]	Cytoplasmic	8.96
WP_156078222.1 MULTISPECIES: sulfotransferase family protein [Alteromonas]	Cytoplasmic	8.96
WP_156078223.1 MULTISPECIES: glycosyltransferase family 2 protein [Alteromonas]	CytoplasmicMembrane	7.88
WP_156078224.1 MULTISPECIES: glycosyltransferase [Alteromonas]	CytoplasmicMembrane	9.82
WP_156078225.1 MULTISPECIES: glycosyltransferase [Alteromonas]	Cytoplasmic	9.97
WP_156078226.1 MULTISPECIES: right-handed parallel beta-helix repeat-containing protein [Alteromonas]	OuterMembrane	9.49
WP_156078227.1 MULTISPECIES: glycosyltransferase family 4 protein [Alteromonas]	Cytoplasmic	8.96
WP_156078228.1 MULTISPECIES: glycosyltransferase [Alteromonadales]	Cytoplasmic	8.96
WP_156078229.1 MULTISPECIES: phenylalanine--tRNA ligase subunit beta [Alteromonas]	Cytoplasmic	9.97
WP_156078230.1 MULTISPECIES: hypothetical protein [Alteromonas]	Unknown	2.00
WP_156078231.1 MULTISPECIES: Cys-tRNA(Pro) deacylase [Alteromonas]	Cytoplasmic	9.26
WP_156078232.1 MULTISPECIES: penicillin acylase family protein [Alteromonas]	Periplasmic	9.44
WP_156078233.1 MULTISPECIES: cob(I)yrinic acid a,c-diamide adenosyltransferase [Alteromonas]	Cytoplasmic	9.26
WP_156078234.1 CsiV family protein [Alteromonas macleodii]	OuterMembrane	9.52
WP_156078235.1 transcription-repair coupling factor [Alteromonas macleodii]	Cytoplasmic	9.97
WP_156078236.1 MULTISPECIES: lipoprotein-releasing ABC transporter permease subunit [Alteromonas]	CytoplasmicMembrane	10.00
WP_156078237.1 MULTISPECIES: sensor histidine kinase [Alteromonas]	CytoplasmicMembrane	7.88
WP_156078238.1 heme oxygenase-like domain-containing protein [Alteromonas macleodii]	Unknown	2.00
WP_156078239.1 MULTISPECIES: glycosyltransferase [Alteromonas]	Unknown	2.00
WP_156078240.1 MULTISPECIES: MFS transporter [Alteromonas]	CytoplasmicMembrane	10.00
WP_156078241.1 phytase [Alteromonas macleodii]	Unknown	2.50
WP_156078242.1 MULTISPECIES: TonB-dependent receptor [Alteromonas]	Unknown	4.44
WP_156078243.1 MULTISPECIES: diguanylate cyclase domain-containing protein [Alteromonas]	CytoplasmicMembrane	10.00
WP_156078244.1 AraC family transcriptional regulator [Alteromonas macleodii]	Unknown	2.00
WP_156078245.1 ATP-dependent RNA helicase HrpA [Alteromonas macleodii]	Unknown	2.00
WP_156078246.1 MULTISPECIES: NAD(P)H-quinone oxidoreductase [Alteromonas]	Cytoplasmic	9.97
WP_156078247.1 MULTISPECIES: TIGR03503 family protein [Alteromonas]	Unknown	2.00
WP_156078248.1 MULTISPECIES: lipoprotein-releasing ABC transporter permease subunit [Alteromonas]	CytoplasmicMembrane	10.00
WP_156078249.1 MULTISPECIES: beta strand repeat-containing protein [Alteromonas]	Extracellular	9.65
WP_156078250.1 type I DNA topoisomerase [Alteromonas macleodii]	Cytoplasmic	9.97
WP_156078251.1 MULTISPECIES: M8 family metallopeptidase [Alteromonas]	Unknown	2.50
WP_156078252.1 MULTISPECIES: molybdenum cofactor guanylyltransferase [Alteromonas]	Unknown	2.00
WP_156078253.1 MULTISPECIES: formate dehydrogenase accessory sulfurtransferase FdhD [Alteromonas]	Cytoplasmic	9.26
WP_156078254.1 FdhF/YdeP family oxidoreductase [Alteromonas macleodii]	Cytoplasmic	9.26
WP_156078255.1 glutathione S-transferase family protein [Alteromonas macleodii]	Unknown	2.00
WP_156078256.1 MULTISPECIES: GNAT family N-acetyltransferase [Alteromonas]	Cytoplasmic	9.97
WP_156078257.1 sensor histidine kinase [Alteromonas macleodii]	CytoplasmicMembrane	10.00
WP_156078258.1 MULTISPECIES: oxidoreductase family protein [Alteromonas]	Unknown	2.00
WP_156078259.1 ribonuclease E [Alteromonas macleodii]	Unknown	6.58
WP_156078260.1 MULTISPECIES: Maf family protein [Alteromonas]	Cytoplasmic	9.26
WP_156078261.1 MULTISPECIES: endolytic transglycosylase MltG [Alteromonas]	Unknown	6.49
WP_156078262.1 MULTISPECIES: DNA polymerase III subunit delta' [Alteromonas]	Cytoplasmic	9.26
WP_156078263.1 pyridoxamine 5'-phosphate oxidase family protein [Alteromonas macleodii]	Unknown	2.00
WP_156078265.1 MULTISPECIES: SDR family NAD(P)-dependent oxidoreductase [Alteromonas]	Cytoplasmic	9.26
WP_156078266.1 MULTISPECIES: haloalkane dehalogenase [Alteromonas]	Periplasmic	9.44
WP_156078267.1 MULTISPECIES: 3-hydroxyacyl-CoA dehydrogenase NAD-binding domain-containing protein [Alteromonas]	Cytoplasmic	9.97
WP_156078268.1 MULTISPECIES: alpha/beta fold hydrolase [Alteromonas]	Extracellular	9.45
WP_156078269.1 MULTISPECIES: purine-cytosine permease family protein [Alteromonas]	CytoplasmicMembrane	10.00
WP_156078270.1 MULTISPECIES: mannitol dehydrogenase family protein [Alteromonas]	Cytoplasmic	9.97
WP_156078271.1 MULTISPECIES: DUF3718 domain-containing protein [Alteromonas]	Unknown	2.50
WP_156078272.1 MULTISPECIES: dihydroorotase [Alteromonas]	Cytoplasmic	9.26
WP_156078273.1 MULTISPECIES: CobW family GTP-binding protein [Alteromonas]	Cytoplasmic	9.97
WP_156078274.1 MULTISPECIES: D-2-hydroxyglutarate dehydrogenase YdiJ [Alteromonas]	Cytoplasmic	9.97
WP_156078275.1 MULTISPECIES: CocE/NonD family hydrolase [Alteromonas]	Unknown	2.50
WP_156078276.1 MULTISPECIES: tRNA pseudouridine(55) synthase TruB [Alteromonas]	Cytoplasmic	9.97
WP_156078277.1 MULTISPECIES: hypothetical protein [Alteromonas]	Unknown	2.00
WP_156078278.1 MULTISPECIES: bifunctional GNAT family N-acetyltransferase/carbon-nitrogen hydrolase family protein [Alteromonas]	Cytoplasmic	9.97
WP_156078279.1 MULTISPECIES: 2OG-Fe(II) oxygenase [Alteromonas]	Cytoplasmic	9.26
WP_156078280.1 MULTISPECIES: response regulator [Alteromonas]	Cytoplasmic	8.96
WP_156078281.1 MULTISPECIES: ExeM/NucH family extracellular endonuclease [Alteromonas]	Unknown	2.50
WP_156078282.1 hypothetical protein [Alteromonas macleodii]	CytoplasmicMembrane	10.00
WP_156078283.1 MULTISPECIES: PepSY-associated TM helix domain-containing protein [Alteromonas]	CytoplasmicMembrane	10.00
WP_156078284.1 MULTISPECIES: S41 family peptidase [Alteromonas]	Extracellular	9.64
WP_156078285.1 MULTISPECIES: hypothetical protein [Alteromonas]	Unknown	2.50
WP_156078286.1 MULTISPECIES: TonB-dependent receptor [Alteromonas]	OuterMembrane	10.00
WP_156078287.1 MULTISPECIES: FAD-dependent oxidoreductase [Alteromonas]	CytoplasmicMembrane	9.99
WP_156078288.1 MULTISPECIES: DUF547 domain-containing protein [Alteromonas]	Unknown	2.50
WP_156078289.1 MULTISPECIES: ABC transporter substrate-binding protein [Alteromonas]	Unknown	2.00
