locus_tag,infected_count_rpkm,uninfected_count_rpkm,log2_fold_change,direction,light_condition,time_point_h,gene_function,pathway
PMM0263,33247,21973,0.597,up,dark,2.5,"amt1, Ammonium transporter family",Transport
RNA_15,178,483,-1.435,down,dark,2.5,"tRNA-Arg2, tRNA-Arg-CCG",Protein translation
PMM0689,283,634,-1.164,down,dark,2.5,"hli22, High light inducbile protein",Light stress response
RNA_20,198,426,-1.106,down,dark,2.5,"tRNA-Ser1, tRNA-Ser-GCT",Protein translation
PMM0740,401,839,-1.065,down,dark,2.5,"petN, Cytochrome b6 f complex subunit VIII",Photosynthetic electron transport
PMM0686,295,601,-1.029,down,dark,2.5,"clpS, ATP-dependent Clp protease adaptor protein ClpS",Proteolysis
PMM0814,832,1686,-1.019,down,dark,2.5,Cytochrome c oxidase subunit VIb-like,Photosynthetic electron transport
PMM1503,250,495,-0.986,down,dark,2.5,"Possible NDP-sugar pyrophosphorylase, LPS biosynthesis",Lipopolysaccharide biosynthesis
PMM1588,269,527,-0.971,down,dark,2.5,Possible conserved carboxylase domain,(unknown)
